Platform,course_title,Institution,num_subscribers,level,published_timestamp,subject
Udemy,Word Swag : Create Stunning Images with the Word Swag App,,2416,All Levels,2016-08-09T17:56:53Z,"Humanities, History, Design, Religion, and Education"
Udemy,How to Draw Majestic Animals: Dogs,,1524,All Levels,2017-05-30T15:30:55Z,"Humanities, History, Design, Religion, and Education"
Udemy,Photoshop Course: Design an eBook Cover in Photoshop,,11893,All Levels,2013-04-25T17:04:18Z,"Humanities, History, Design, Religion, and Education"
Udemy,Digital Art for Beginners,,3381,Beginner,2016-02-14T23:43:10Z,"Humanities, History, Design, Religion, and Education"
Udemy,Learn How To Design a Logo in Adobe Illustrator in 30 Mins,,1270,Beginner,2017-01-16T22:00:29Z,"Humanities, History, Design, Religion, and Education"
Udemy,The most popular techniques in Photoshop,,1753,Intermediate,2017-02-21T18:07:38Z,"Humanities, History, Design, Religion, and Education"
Udemy,Become a Professional Graphic Designer,,3618,All Levels,2014-08-13T16:37:12Z,"Humanities, History, Design, Religion, and Education"
Udemy,Adobe Illustrator CC 2017 for beginners,,2489,Beginner,2017-01-31T22:13:11Z,"Humanities, History, Design, Religion, and Education"
Udemy,How to Draw Cute Cartoon Characters,,4080,All Levels,2013-10-01T01:11:51Z,"Humanities, History, Design, Religion, and Education"
Udemy,How to Create awesome Cinema-graph With Adobe Photoshop?,,1602,Beginner,2017-05-07T16:32:00Z,"Humanities, History, Design, Religion, and Education"
Udemy,Learn to Create a Mandala with Adobe Illustrator,,7,All Levels,2017-04-24T19:24:51Z,"Humanities, History, Design, Religion, and Education"
Udemy,15  Motion Graphic Elements in After Effect (Series 2),,8,Intermediate,2017-04-11T04:27:34Z,"Humanities, History, Design, Religion, and Education"
Udemy,Fantasy map design,,7,All Levels,2017-03-16T16:31:23Z,"Humanities, History, Design, Religion, and Education"
Udemy,Creating 2D Game Assets,,57,All Levels,2015-04-17T22:34:55Z,"Humanities, History, Design, Religion, and Education"
Udemy,create 9 professional logo design full version,,91,All Levels,2013-07-23T10:40:16Z,"Humanities, History, Design, Religion, and Education"
Udemy,Stencil - Simple Graphic Design For Entrepreneurs,,11,All Levels,2017-01-03T12:28:37Z,"Humanities, History, Design, Religion, and Education"
Udemy,Learn Adobe InDesign from Scratch,,6,Beginner,2016-06-20T15:34:32Z,"Humanities, History, Design, Religion, and Education"
Udemy,Getting the Life of an Instructional Designer,,5,All Levels,2017-05-01T00:12:09Z,"Humanities, History, Design, Religion, and Education"
Udemy,Drawing for All Levels: How to Design Cartoon Women,,5,All Levels,2015-07-14T22:01:30Z,"Humanities, History, Design, Religion, and Education"
Udemy,Photoshop Tools 101,,6,All Levels,2017-05-01T21:49:18Z,"Humanities, History, Design, Religion, and Education"
Udemy,How to create gif animation in photoshop,,34,All Levels,2015-06-02T19:06:24Z,"Humanities, History, Design, Religion, and Education"
Udemy,How to Color Comic Books... with a Mouse,,7,All Levels,2017-01-03T14:38:04Z,"Humanities, History, Design, Religion, and Education"
Udemy,Bestseller! Learn Photoshop in 1 Hour (No Experience Needed),,5471,Beginner,2015-03-05T22:03:28Z,"Humanities, History, Design, Religion, and Education"
Udemy,How To Design A Fortune 500 Logo in Illustrator,,3599,Intermediate,2016-01-24T22:45:26Z,"Humanities, History, Design, Religion, and Education"
Udemy,Canva : Graphic Design Theory Volume2,,4961,All Levels,2015-06-20T00:03:03Z,"Humanities, History, Design, Religion, and Education"
Udemy,Canva : Book Cover Design,,3377,Beginner,2016-02-26T01:08:20Z,"Humanities, History, Design, Religion, and Education"
Udemy,The Complete Figure Drawing Course HD,,1323,Beginner,2016-10-11T21:40:06Z,"Humanities, History, Design, Religion, and Education"
Udemy,Mastering Logo Design - 20 Projects step-by-step,,2599,All Levels,2016-09-25T17:57:11Z,"Humanities, History, Design, Religion, and Education"
Udemy,Graphic Design: Create Animated GIF Ad Banners in Photoshop,,6612,All Levels,2014-12-19T22:46:05Z,"Humanities, History, Design, Religion, and Education"
Udemy,Learn Inkscape : Design Logos and Game Arts,,1675,Beginner,2017-03-15T16:46:00Z,"Humanities, History, Design, Religion, and Education"
Udemy,Typography: Learn the Basics to Build a Solid Foundation,,5850,Beginner,2015-05-26T17:36:32Z,"Humanities, History, Design, Religion, and Education"
Udemy,Master Manga Studio 5: Bonus Drawing and Painting,,2325,All Levels,2015-02-06T07:44:43Z,"Humanities, History, Design, Religion, and Education"
Udemy,Learn Adobe Photoshop from scratch to professional,,1276,Beginner,2017-04-05T21:50:14Z,"Humanities, History, Design, Religion, and Education"
Udemy,7 Secrets To Designing In Black and White,,1000,All Levels,2017-06-27T19:55:18Z,"Humanities, History, Design, Religion, and Education"
Udemy,Photoshop CS 6 ile FotoÄŸraf Ä°ÅŸlemenin Temelleri,,86,Beginner,2015-02-13T07:07:44Z,"Humanities, History, Design, Religion, and Education"
Udemy,èª°ã§ã‚‚ã‚ã‹ã‚‹ Adobe Illustrator CS6,,11,Beginner,2015-10-22T18:40:54Z,"Humanities, History, Design, Religion, and Education"
Udemy,Devenez le king de l'illustration automobile,,42,Beginner,2015-12-09T16:49:20Z,"Humanities, History, Design, Religion, and Education"
Udemy,Corel Draw X7 EÄŸitimi (Temelden Ä°leri Seviyeye),,28,All Levels,2016-06-09T21:43:59Z,"Humanities, History, Design, Religion, and Education"
Udemy,è°ƒè‰²ä¸­çº§è¯¾ç¨‹,,5,Beginner,2017-03-31T17:19:38Z,"Humanities, History, Design, Religion, and Education"
Udemy,Drawing and paint  hot girl with photoshop,,74,All Levels,2016-11-24T22:02:38Z,"Humanities, History, Design, Religion, and Education"
Udemy,Photoshop CC EÄŸitim Seti (YENÄ°),,27,All Levels,2017-03-30T22:26:26Z,"Humanities, History, Design, Religion, and Education"
Udemy,Ù…Ø¯Ø®Ù„ ÙÙŠ Ø£Ø³Ø§Ø³ÙŠØ§Øª Ø§Ù„ÙÙˆØ·ÙˆØ´ÙˆØ¨ Ù„Ù„Ù…Ø¨ØªØ¯Ø¦ÙŠÙ† ÙÙ‚Ø·,,13,Beginner,2016-09-06T02:48:13Z,"Humanities, History, Design, Religion, and Education"
Udemy,CreaciÃ³n de iconos con Illustrator,,27,All Levels,2015-01-17T02:28:25Z,"Humanities, History, Design, Religion, and Education"
Udemy,Adobe Illustrator Course in Urdu Basics Level Training,,1433,Beginner,2016-01-19T17:22:59Z,"Humanities, History, Design, Religion, and Education"
Udemy,GraphicDesign Studio,,110,Beginner,2016-05-27T20:34:07Z,"Humanities, History, Design, Religion, and Education"
Udemy,Aula de Photoshop - Aprenda como recortar imagens,,15,Beginner,2017-07-03T00:56:30Z,"Humanities, History, Design, Religion, and Education"
Udemy,Make your own great designs in PowerPoint: Quick & Easy,,19,Beginner,2015-09-30T17:30:55Z,"Humanities, History, Design, Religion, and Education"
Udemy,Create Kindle eBook Covers with PowerPoint,,87,All Levels,2014-06-17T07:51:54Z,"Humanities, History, Design, Religion, and Education"
Udemy,Magazine Design: Start your own magazine in less than 24hrs,,802,All Levels,2015-03-22T20:27:01Z,"Humanities, History, Design, Religion, and Education"
Udemy,Essential Skills for Designers - Adobe Bridge,,14,All Levels,2016-05-17T23:40:40Z,"Humanities, History, Design, Religion, and Education"
Udemy,Learn to code in Python and learn Adobe Photoshop today!,,1132,All Levels,2015-07-08T00:15:12Z,"Humanities, History, Design, Religion, and Education"
Udemy,How to draw Caricatures,,347,All Levels,2013-08-21T16:58:27Z,"Humanities, History, Design, Religion, and Education"
Udemy,Essential Skills for Designers - Working with Type,,219,All Levels,2013-05-13T12:59:44Z,"Humanities, History, Design, Religion, and Education"
Udemy,Affinity Designer for beginners,,30,Beginner,2017-05-01T20:48:32Z,"Humanities, History, Design, Religion, and Education"
Udemy,How to Create Top Ranking Mobile App Icons - iOS Edition,,130,All Levels,2013-07-30T16:43:28Z,"Humanities, History, Design, Religion, and Education"
Udemy,Canva - Making Design Simple,,509,All Levels,2015-06-24T18:57:24Z,"Humanities, History, Design, Religion, and Education"
Udemy,Ribbon Lettering: From Sketch to Wordmark,,342,All Levels,2015-10-25T20:54:43Z,"Humanities, History, Design, Religion, and Education"
Udemy,How to Make a Custom Graphic ,,87,Beginner,2013-10-24T04:16:41Z,"Humanities, History, Design, Religion, and Education"
Udemy,Create Flat Designs with Inkscape ,,259,Beginner,2016-02-14T21:56:08Z,"Humanities, History, Design, Religion, and Education"
Udemy,:::Beginners Guide To Creating Amazing Images with Canva:::,,72,Beginner,2014-04-29T19:50:31Z,"Humanities, History, Design, Religion, and Education"
Udemy,Learn To Draw - The COMIC BOOK STYLE,,363,All Levels,2012-06-01T21:53:11Z,"Humanities, History, Design, Religion, and Education"
Udemy,Adobe Illustrator Vectors For Hand Letterers,,23,Beginner,2016-10-21T18:50:38Z,"Humanities, History, Design, Religion, and Education"
Udemy,How To Create Amazing YouTube Custom Thumbnail Images,,78,All Levels,2013-09-29T22:43:14Z,"Humanities, History, Design, Religion, and Education"
Udemy,Graphic Design Bootcamp: Professional Workflow & Layout Tips,,99,All Levels,2015-03-26T18:24:10Z,"Humanities, History, Design, Religion, and Education"
Udemy,Promotional Design Master Class,,14,All Levels,2016-12-24T05:22:40Z,"Humanities, History, Design, Religion, and Education"
Udemy,Introduction to GIMP 2.8: Tutorials for Beginners,,282,Beginner,2016-04-01T17:31:53Z,"Humanities, History, Design, Religion, and Education"
Udemy,48 Logo Designs and Techniques,,113,All Levels,2015-09-15T00:23:14Z,"Humanities, History, Design, Religion, and Education"
Udemy,Photoshop JumpStart,,66,Beginner,2015-07-02T21:41:25Z,"Humanities, History, Design, Religion, and Education"
Udemy,How To Sell Practically Anything: Professional Design Mockup,,52,All Levels,2014-10-08T09:08:28Z,"Humanities, History, Design, Religion, and Education"
Udemy,"Learn Calligraphy, Handwriting animation wz After Effects",,116,All Levels,2016-11-03T21:56:02Z,"Humanities, History, Design, Religion, and Education"
Udemy,LaTeX A-Z: from beginner to advance in less than 3 hour,,623,Beginner,2017-03-27T18:46:54Z,"Humanities, History, Design, Religion, and Education"
Udemy,Course Bundle | Exploring Art : Silhouette & Linear Line Art,,827,All Levels,2017-04-24T16:52:39Z,"Humanities, History, Design, Religion, and Education"
Udemy,How To Build Your Own Web Banner Design Business,,5000,All Levels,2016-07-05T18:41:46Z,"Humanities, History, Design, Religion, and Education"
Udemy,Canva: Design and Sell Your Own Professional Canva Designs,,793,All Levels,2017-03-02T00:59:33Z,"Humanities, History, Design, Religion, and Education"
Udemy,How to Design a Logo in Adobe Illustrator,,972,All Levels,2016-11-14T15:26:17Z,"Humanities, History, Design, Religion, and Education"
Udemy,Illustrator CC: Design and drawing from scratch to expert!,,2427,Beginner,2016-12-15T15:18:47Z,"Humanities, History, Design, Religion, and Education"
Udemy,Logo design: How To Design an Awesome Logo in Illustrator,,3131,All Levels,2014-11-28T09:04:50Z,"Humanities, History, Design, Religion, and Education"
Udemy,Photoshop: Real World Hands-on Freelance Mastery,,5950,All Levels,2014-09-25T09:14:15Z,"Humanities, History, Design, Religion, and Education"
Udemy,Graphic Design: Beginner's Graphic Design Guide to Photoshop,,4550,All Levels,2015-05-20T21:10:45Z,"Humanities, History, Design, Religion, and Education"
Udemy,Most Wanted Flat Design Techniques,,2081,Intermediate,2016-03-17T18:21:18Z,"Humanities, History, Design, Religion, and Education"
Udemy,3DS MAX - Learn 3Ds MAX tutorial for Beginners in Urdu Hindi,,785,All Levels,2017-04-18T16:45:59Z,"Humanities, History, Design, Religion, and Education"
Udemy,Design your own Social Media Logo Icons in Adobe Illustrator,,2424,Beginner,2016-06-05T15:11:49Z,"Humanities, History, Design, Religion, and Education"
Udemy,Mashup - Transform a scanned sketch into a digital painting,,57,Intermediate,2014-10-23T00:42:36Z,"Humanities, History, Design, Religion, and Education"
Udemy,Motion Graphic With After Effect From Scratch in 5 Hours,,50,All Levels,2016-06-01T17:40:56Z,"Humanities, History, Design, Religion, and Education"
Udemy,Introduction to Photoshop CC: Tutorials for Beginners,,262,Beginner,2016-04-10T20:12:18Z,"Humanities, History, Design, Religion, and Education"
Udemy,Making Killer Images in Photoshop that WOW Clients!,,45,Intermediate,2014-10-25T03:57:07Z,"Humanities, History, Design, Religion, and Education"
Udemy,Simple Photoshop CC: Smart Objects,,272,Intermediate,2016-03-15T14:49:51Z,"Humanities, History, Design, Religion, and Education"
Udemy,Learn Photo Manipulation - Build 3 projects,,10,All Levels,2016-11-27T16:01:42Z,"Humanities, History, Design, Religion, and Education"
Udemy,Zombie Apocalypse Photoshop Actions,,12,All Levels,2016-09-26T22:19:48Z,"Humanities, History, Design, Religion, and Education"
Udemy,Creative Perspective Illustration with GIMP,,43,All Levels,2016-11-24T18:24:48Z,"Humanities, History, Design, Religion, and Education"
Udemy,iPhone icons in iOS7 - learn flat design,,165,All Levels,2013-08-21T20:00:26Z,"Humanities, History, Design, Religion, and Education"
Udemy,How to draw professional manga artwork by Punix,,83,Beginner,2017-04-17T22:55:46Z,"Humanities, History, Design, Religion, and Education"
Udemy,How do I Create a Stylized Graphics from Images in Photoshop,,17,All Levels,2015-09-28T17:20:55Z,"Humanities, History, Design, Religion, and Education"
Udemy,Advance Design of Logos and Brand Identity   ,,34,All Levels,2013-02-16T00:06:30Z,"Humanities, History, Design, Religion, and Education"
Udemy,Como utilizar o Corel Draw por completo!,,293,All Levels,2015-08-17T17:21:52Z,"Humanities, History, Design, Religion, and Education"
Udemy,Photoshopã€€ä¸­ç´šè€…ã€ä¸Šç´šè€…ãŒãƒ—ãƒ­ã«ãªã‚‹ãŸã‚ã«æœ€å¾Œã«å­¦ã¶ã€Œè¶…çµ¶æŠ€å·§ã€ãƒ†ã‚¯ãƒ‹ãƒƒã‚¯,,113,Intermediate,2016-01-12T21:37:39Z,"Humanities, History, Design, Religion, and Education"
Udemy,Corel Draw X7: MÃ£o na Massa,,72,Beginner,2016-06-20T22:30:56Z,"Humanities, History, Design, Religion, and Education"
Udemy,Dibujo digital bÃ¡sico: cÃ³mo ilustrar en Photoshop,,155,Beginner,2016-02-17T23:56:26Z,"Humanities, History, Design, Religion, and Education"
Udemy,Adobe Illustrator CS6 Ø¨Ø§Ù„Ù„ØºØ© Ø§Ù„Ø¹Ø±Ø¨ÙŠØ©,,48,All Levels,2014-09-14T15:00:09Z,"Humanities, History, Design, Religion, and Education"
Udemy,Creare un logo con Adobe Illustrator,,1447,All Levels,2015-10-29T00:10:41Z,"Humanities, History, Design, Religion, and Education"
Udemy,Mestres do Photoshop,,86,All Levels,2015-08-21T23:40:31Z,"Humanities, History, Design, Religion, and Education"
Udemy,illustrator CC 2015.3 - Curso bÃ¡sico de ferramentas,,13,Beginner,2016-07-08T15:23:08Z,"Humanities, History, Design, Religion, and Education"
Udemy,Plantillas Powerpoint para Publicar en Mercadolibre y Ebay,,15,All Levels,2015-06-08T15:32:34Z,"Humanities, History, Design, Religion, and Education"
Udemy,Crie seu CartÃ£o de Visita no CorelDRAW X8,,28,Beginner,2017-03-02T17:04:04Z,"Humanities, History, Design, Religion, and Education"
Udemy,Curso de Maya 3D,,62,All Levels,2016-02-09T17:35:50Z,"Humanities, History, Design, Religion, and Education"
Udemy,Photoshop: OrganizaciÃ³n de eventos y decoraciÃ³n de fiestas,,125,Beginner,2016-10-18T20:08:18Z,"Humanities, History, Design, Religion, and Education"
Udemy,Podcast Cover Art | Design Like the Best,,33,All Levels,2015-04-22T00:37:42Z,"Humanities, History, Design, Religion, and Education"
Udemy,Learn Drawing and Painting a Landscape with Oil Colours,,51,Intermediate,2014-01-14T20:01:11Z,"Humanities, History, Design, Religion, and Education"
Udemy,Enhance your chroma key with an animated Slides background,,361,Intermediate,2016-07-04T18:50:33Z,"Humanities, History, Design, Religion, and Education"
Udemy,The Complete Motion Graphic Course,,50,All Levels,2017-02-01T23:42:53Z,"Humanities, History, Design, Religion, and Education"
Udemy,Making Corporate Flyers in Photoshop,,4,All Levels,2016-02-05T19:58:53Z,"Humanities, History, Design, Religion, and Education"
Udemy,Rock-Solid Brands,,134,Beginner,2016-02-17T17:06:32Z,"Humanities, History, Design, Religion, and Education"
Udemy,Typographic Poster Design - From Sketch to Vector,,36,Intermediate,2015-10-08T17:21:31Z,"Humanities, History, Design, Religion, and Education"
Udemy,"Make Money With Photoshop: Logos, Business Cards & Brochures",,32,All Levels,2016-08-14T22:05:04Z,"Humanities, History, Design, Religion, and Education"
Udemy,Photoshop the Art of Clipart,,30,Beginner,2015-07-05T23:38:42Z,"Humanities, History, Design, Religion, and Education"
Udemy,Adobe Illustrator Creative Cloud:  Mastering the Upgrades,,22,Intermediate,2015-03-16T20:18:11Z,"Humanities, History, Design, Religion, and Education"
Udemy,Illustrator 101: Learn Quickly and Easily to create Artwork,,452,All Levels,2014-11-25T03:36:40Z,"Humanities, History, Design, Religion, and Education"
Udemy,Design Your Own Fonts. Plus A Bunch Of Typography Secrets.,,67,All Levels,2016-07-14T17:03:19Z,"Humanities, History, Design, Religion, and Education"
Udemy,Easy Steps To Become A Photoshop Expert,,1081,All Levels,2015-01-29T04:40:00Z,"Humanities, History, Design, Religion, and Education"
Udemy,Intro to Adobe Illustrator,,189,Beginner,2015-08-07T21:56:22Z,"Humanities, History, Design, Religion, and Education"
Udemy,Beginners Guide: Photoshop Poster/Artwork,,775,Beginner,2016-04-02T05:26:22Z,"Humanities, History, Design, Religion, and Education"
Udemy,Basic Graphic Design for PowerPoint,,88,Beginner,2015-07-26T23:32:34Z,"Humanities, History, Design, Religion, and Education"
Udemy,Master Graphic Design Using Photoshop with Rachael,,598,All Levels,2014-11-07T09:12:47Z,"Humanities, History, Design, Religion, and Education"
Udemy,Adobe Illustrator CC - Print Design for Beginners,,145,Beginner,2016-03-08T15:09:47Z,"Humanities, History, Design, Religion, and Education"
Udemy,Adobe Illustrator | Master in 3D,,445,All Levels,2016-07-28T00:23:08Z,"Humanities, History, Design, Religion, and Education"
Udemy,From Drawing to Illustration,,237,Beginner,2015-04-17T17:20:21Z,"Humanities, History, Design, Religion, and Education"
Udemy,Adobe Suite : Unleash your creativity & benefit from it !,,1005,All Levels,2015-11-09T23:01:14Z,"Humanities, History, Design, Religion, and Education"
Udemy,Become a Logo Designer: Guide to Complimentary Logo Software,,485,All Levels,2015-03-19T23:45:57Z,"Humanities, History, Design, Religion, and Education"
Udemy,DIY Beautiful Social Graphics That Don't Require Photoshop,,238,All Levels,2015-03-03T21:17:04Z,"Humanities, History, Design, Religion, and Education"
Udemy,Design while you learn InDesign CC,,1116,Beginner,2014-04-07T17:28:14Z,"Humanities, History, Design, Religion, and Education"
Udemy,R Graph Essentials,,105,All Levels,2015-01-21T07:26:49Z,"Humanities, History, Design, Religion, and Education"
Udemy,Car Sketching with Simple Analog Tools,,23,All Levels,2016-08-29T18:50:57Z,"Humanities, History, Design, Religion, and Education"
Udemy,Drawing Anime & Manga Style,,82,All Levels,2015-07-10T23:16:44Z,"Humanities, History, Design, Religion, and Education"
Udemy,Inkscape 101 for Beginners - Design Vector Graphics,,13,Beginner,2016-06-13T18:28:02Z,"Humanities, History, Design, Religion, and Education"
Udemy,"How to Fix Common Branding Mistakes, for Graphic Designers",,19,Intermediate,2016-11-18T22:15:11Z,"Humanities, History, Design, Religion, and Education"
Udemy,AutoCAD Course - Learn Online AutoCAD in Urdu Hindi,,105,All Levels,2017-06-13T17:32:48Z,"Humanities, History, Design, Religion, and Education"
Udemy,Mind-Blowing Photoshop: Master Skills Season 1,,94,All Levels,2014-08-08T16:12:02Z,"Humanities, History, Design, Religion, and Education"
Udemy,Architectural Drawing For Creatives,,5,All Levels,2017-06-21T15:35:08Z,"Humanities, History, Design, Religion, and Education"
Udemy,Adobe Photoshop (Complete Beginner),,98,Beginner,2015-12-09T17:17:38Z,"Humanities, History, Design, Religion, and Education"
Udemy,Character Design,,5,Intermediate,2017-05-31T18:31:33Z,"Humanities, History, Design, Religion, and Education"
Udemy,Icon Design Masterclass: Learn Icon Design Principles,,6,Beginner,2017-05-05T17:05:21Z,"Humanities, History, Design, Religion, and Education"
Udemy,create stunning Photoshop compositions in minutes,,5,All Levels,2017-06-07T19:24:37Z,"Humanities, History, Design, Religion, and Education"
Udemy,Marvelous Logo Design,,91,All Levels,2015-01-30T03:53:23Z,"Humanities, History, Design, Religion, and Education"
Udemy,Canva Complete Course For Graphics Design | 20 Projects,,3,All Levels,2017-06-27T15:22:40Z,"Humanities, History, Design, Religion, and Education"
Udemy,The Complete Video Production Guide - Learn Top Video Tools,,121,All Levels,2015-05-25T23:21:06Z,"Humanities, History, Design, Religion, and Education"
Udemy,Drawing With Confidence,,105,All Levels,2012-05-04T07:24:05Z,"Humanities, History, Design, Religion, and Education"
Udemy,Add realistic car paint to your pencil drawing in Photoshop!,,17,Beginner,2017-02-02T19:03:50Z,"Humanities, History, Design, Religion, and Education"
Udemy,T-Shirt Sales - Merch By Amazon Profit Formula With Canva,,380,All Levels,2017-06-26T18:13:55Z,"Humanities, History, Design, Religion, and Education"
Udemy,Learn print production from start to finish,,494,All Levels,2015-05-04T20:50:35Z,"Humanities, History, Design, Religion, and Education"
Udemy,Step by Step Gif animation in Photoshop,,518,All Levels,2015-06-08T18:40:03Z,"Humanities, History, Design, Religion, and Education"
Udemy,Adobe - Create a professional logo step-by-step (Farming),,214,All Levels,2016-08-18T23:51:44Z,"Humanities, History, Design, Religion, and Education"
Udemy,Adobe Illustrator CC Advanced,,11,Beginner,2017-03-08T03:16:33Z,"Humanities, History, Design, Religion, and Education"
Udemy,Mastering Realistic Real Life Drawing with Pencil,,33,Beginner,2015-04-20T18:08:39Z,"Humanities, History, Design, Religion, and Education"
Udemy,Silhouettes that Sells,,9,Beginner,2017-03-23T21:08:59Z,"Humanities, History, Design, Religion, and Education"
Udemy,FullPage: The Complete Guide to Flat Websites,,817,All Levels,2013-11-18T08:27:35Z,"Humanities, History, Design, Religion, and Education"
Udemy,How to design professional PowerPoint business presentation,,286,All Levels,2014-11-11T19:49:41Z,"Humanities, History, Design, Religion, and Education"
Udemy,Pic Monkey for Beginners - Graphic Design and Photo Editing,,774,Beginner,2015-11-08T22:12:37Z,"Humanities, History, Design, Religion, and Education"
Udemy,Corel Painter 2016,,41,All Levels,2016-05-11T14:51:26Z,"Humanities, History, Design, Religion, and Education"
Udemy,eBook Cover Design,,30,Intermediate,2014-11-04T20:56:51Z,"Humanities, History, Design, Religion, and Education"
Udemy,"Photoshop tips and tricks, how to change clothes",,837,All Levels,2015-03-16T18:36:17Z,"Humanities, History, Design, Religion, and Education"
Udemy,How to make Better Compositions: Take your art to new height,,11,All Levels,2016-08-04T13:33:30Z,"Humanities, History, Design, Religion, and Education"
Udemy,Adobe Photoshop CC | The Essential Guide,,254,All Levels,2015-05-12T00:19:27Z,"Humanities, History, Design, Religion, and Education"
Udemy,Learn to Composite a 2D Action Shot in Photoshop,,40,Beginner,2016-09-10T21:38:26Z,"Humanities, History, Design, Religion, and Education"
Udemy,Infographic Design: How To Create Your Own Infographic,,84,All Levels,2015-05-12T20:38:58Z,"Humanities, History, Design, Religion, and Education"
Udemy,Autodesk Inventor 2016 : Complete Guide ,,23,Beginner,2016-03-22T20:35:56Z,"Humanities, History, Design, Religion, and Education"
Udemy,Amazing Graphic Design for Beginners,,32,Beginner,2015-07-08T19:58:01Z,"Humanities, History, Design, Religion, and Education"
EdX,Justice,HarvardX,58779,,3/2/2013,"Humanities, History, Design, Religion, and Education"
EdX,The Ancient Greek Hero,HarvardX,25873,,3/13/2013,"Humanities, History, Design, Religion, and Education"
EdX,The Ancient Greek Hero,HarvardX,17604,,9/3/2013,"Humanities, History, Design, Religion, and Education"
EdX,Global Architecture,MITx,17077,,9/17/2013,"Humanities, History, Design, Religion, and Education"
EdX,"Introduction to Philosophy: God, Knowledge and Consciousness",MITx,34371,,10/1/2013,"Humanities, History, Design, Religion, and Education"
EdX,The Political and Intellectual Foundations of China,HarvardX,47384,,10/31/2013,"Humanities, History, Design, Religion, and Education"
EdX,Poetry in America: The Poetry of Early New England,HarvardX,6446,,10/31/2013,"Humanities, History, Design, Religion, and Education"
EdX,The Creation and End of a Centralized Empire,HarvardX,12856,,1/2/2014,"Humanities, History, Design, Religion, and Education"
EdX,Early Christianity: The Letters of Paul,HarvardX,33784,,1/5/2014,"Humanities, History, Design, Religion, and Education"
EdX,Poetry in America: Whitman,HarvardX,8685,,1/15/2014,"Humanities, History, Design, Religion, and Education"
EdX,Cosmopolitan Tang: Aristocratic Culture,HarvardX,7422,,2/13/2014,"Humanities, History, Design, Religion, and Education"
EdX,Unlocking the Immunity to Change,HarvardX,39319,,3/11/2014,"Humanities, History, Design, Religion, and Education"
EdX,A New National Culture,HarvardX,6753,,3/20/2014,"Humanities, History, Design, Religion, and Education"
EdX,HarvardX for Alumni: Explorations in Learning,HarvardX,7156,,3/22/2014,"Humanities, History, Design, Religion, and Education"
EdX,Justice,HarvardX,35409,,4/8/2014,"Humanities, History, Design, Religion, and Education"
