Platform,course_title,Institution,num_subscribers,level,published_timestamp,subject
Coursera,"The Modern World, Part One: Global History from 1760 to 1910",University of Virginia,"130,000",Beginner,,"Humanities, History, Design, Religion, and Education"
Coursera,Love as a Force for Social Justice,Stanford University,"14,000",Beginner,,"Humanities, History, Design, Religion, and Education"
Coursera,"The Modern World, Part Two: Global History since 1910",University of Virginia,"47,000",Beginner,,"Humanities, History, Design, Religion, and Education"
Coursera,"Cameras, Exposure, and Photography",Michigan State University,"130,000",All Levels,,"Humanities, History, Design, Religion, and Education"
Coursera,The Cycle: Management of Successful Arts and Cultural Organizations,"University of Maryland, College Park","11,000",Beginner,,"Humanities, History, Design, Religion, and Education"
Coursera,Egiptología (Egyptology),Universitat Autònoma de Barcelona,"46,000",Beginner,,"Humanities, History, Design, Religion, and Education"
Coursera,UX Design Fundamentals,California Institute of the Arts,"25,000",Beginner,,"Humanities, History, Design, Religion, and Education"
Coursera,Introduction to Classical Music,Yale University,"150,000",All Levels,,"Humanities, History, Design, Religion, and Education"
Coursera,Write A Feature Length Screenplay For Film Or Television,Michigan State University,"12,000",Beginner,,"Humanities, History, Design, Religion, and Education"
Coursera,Ancient Philosophy: Aristotle and His Successors,University of Pennsylvania,"8,100",All Levels,,"Humanities, History, Design, Religion, and Education"
Coursera,Magic in the Middle Ages,Universitat de Barcelona,"78,000",Beginner,,"Humanities, History, Design, Religion, and Education"
Coursera,Art & Activity: Interactive Strategies for Engaging with Art,The Museum of Modern Art,"79,000",All Levels,,"Humanities, History, Design, Religion, and Education"
Coursera,Developing Your Musicianship,Berklee College of Music,"54,000",Beginner,,"Humanities, History, Design, Religion, and Education"
Coursera,Developing Your Musicianship,Berklee College of Music,"41,000",All Levels,,"Humanities, History, Design, Religion, and Education"
Coursera,The Art of Music Production,Berklee College of Music,"47,000",Intermediate,,"Humanities, History, Design, Religion, and Education"
Coursera,Introduction to Typography,California Institute of the Arts,"72,000",Beginner,,"Humanities, History, Design, Religion, and Education"
Coursera,Guitar for Beginners,Berklee College of Music,"210,000",All Levels,,"Humanities, History, Design, Religion, and Education"
Coursera,Modern Art & Ideas,The Museum of Modern Art,"310,000",Beginner,,"Humanities, History, Design, Religion, and Education"
Coursera,Curanderismo: Traditional Healing Using Plants,University of New Mexico,"5,500",Beginner,,"Humanities, History, Design, Religion, and Education"
Coursera,Making Architecture,IE School of Architecture & Design,"43,000",Beginner,,"Humanities, History, Design, Religion, and Education"
Coursera,Creative Writing: The Craft of Plot,Wesleyan University,"120,000",All Levels,,"Humanities, History, Design, Religion, and Education"
Coursera,Age of Cathedrals,Yale University,"21,000",Beginner,,"Humanities, History, Design, Religion, and Education"
Coursera,Introduction to Imagemaking,California Institute of the Arts,"54,000",Beginner,,"Humanities, History, Design, Religion, and Education"
Coursera,Fundamentals of Graphic Design,California Institute of the Arts,"290,000",Beginner,,"Humanities, History, Design, Religion, and Education"
Coursera,Getting Started With Music Theory,Michigan State University,"59,000",Beginner,,"Humanities, History, Design, Religion, and Education"
Coursera,The Technology of Music Production,Berklee College of Music,"28,000",Beginner,,"Humanities, History, Design, Religion, and Education"
Coursera,English Composition I,Duke University,"200,000",Beginner,,"Humanities, History, Design, Religion, and Education"
Coursera,Music Business Foundations,Berklee College of Music,"34,000",All Levels,,"Humanities, History, Design, Religion, and Education"
Coursera,Feminism and Social Justice,"University of California, Santa Cruz","18,000",Beginner,,"Humanities, History, Design, Religion, and Education"
Coursera,"Transmedia Storytelling: Narrative worlds, emerging technologies, and global audiences",UNSW Sydney (The University of New South Wales),"45,000",All Levels,,"Humanities, History, Design, Religion, and Education"
Coursera,Songwriting: Writing the Lyrics,Berklee College of Music,"68,000",Beginner,,"Humanities, History, Design, Religion, and Education"
Coursera,Wonders of Ancient Egypt,University of Pennsylvania,"17,000",Intermediate,,"Humanities, History, Design, Religion, and Education"
Coursera,Indigenous Canada,University of Alberta,"51,000",All Levels,,"Humanities, History, Design, Religion, and Education"
Coursera,Fashion as Design,The Museum of Modern Art,"180,000",Beginner,,"Humanities, History, Design, Religion, and Education"
Coursera,In the Studio: Postwar Abstract Painting,The Museum of Modern Art,"79,000",Beginner,,"Humanities, History, Design, Religion, and Education"
Coursera,Sharpened Visions: A Poetry Workshop,California Institute of the Arts,"61,000",Beginner,,"Humanities, History, Design, Religion, and Education"
Coursera,Art & Ideas: Teaching with Themes,The Museum of Modern Art,"31,000",All Levels,,"Humanities, History, Design, Religion, and Education"
Coursera,Introduction to Ableton Live,Berklee College of Music,"60,000",All Levels,,"Humanities, History, Design, Religion, and Education"
Coursera,Roman Architecture,Yale University,"30,000",Beginner,,"Humanities, History, Design, Religion, and Education"
Coursera,Fundamentals of Music Theory,The University of Edinburgh,"180,000",Beginner,,"Humanities, History, Design, Religion, and Education"
Coursera,Introduction to Philosophy,The University of Edinburgh,"370,000",All Levels,,"Humanities, History, Design, Religion, and Education"
Coursera,What Is Contemporary Art?,The Museum of Modern Art,"120,000",Beginner,,"Humanities, History, Design, Religion, and Education"
Coursera,Greek and Roman Mythology,University of Pennsylvania,"260,000",All Levels,,"Humanities, History, Design, Religion, and Education"
Coursera,Digital Product Management: Modern Fundamentals,University of Virginia,"58,000",Beginner,,Business Finance
Coursera,Forensic Accounting and Fraud Examination,West Virginia University,"42,000",All Levels,,Business Finance
Coursera,Managerial Accounting Fundamentals,University of Virginia,"11,000",Beginner,,Business Finance
Coursera,The Strategy of Content Marketing,"University of California, Davis","100,000",Intermediate,,Business Finance
Coursera,Construction Project Management,Columbia University,"43,000",Beginner,,Business Finance
Coursera,Introduction to Spreadsheets and Models,University of Pennsylvania,"76,000",All Levels,,Business Finance
Coursera,Decision-Making and Scenarios,University of Pennsylvania,"31,000",All Levels,,Business Finance
Coursera,"Innovation Through Design: Think, Make, Break, Repeat",The University of Sydney,"10,000",Beginner,,Business Finance
Coursera,Aspectos básicos de la planificación y la gestión de proyectos,University of Virginia,"10,000",Beginner,,Business Finance
Coursera,Marketing Gerencial,Universidad de Chile,"49,000",Intermediate,,Business Finance
Coursera,Entrepreneurship Strategy: From Ideation to Exit,HEC Paris,"20,000",Beginner,,Business Finance
Coursera,The Science of Success: What Researchers Know that You Should Know,University of Michigan,"59,000",Beginner,,Business Finance
Coursera,Arts and Heritage Management,Università Bocconi,"15,000",All Levels,,Business Finance
Coursera,Fundamentals of Quantitative Modeling,University of Pennsylvania,"110,000",All Levels,,Business Finance
Coursera,Enterprise Architecture,Peter the Great St. Petersburg Polytechnic University,"2,400",Beginner,,Business Finance
Coursera,What is Social?,Northwestern University,"94,000",All Levels,,Business Finance
Coursera,Corporate Finance Essentials,IESE Business School,"56,000",All Levels,,Business Finance
Coursera,Financial Accounting Fundamentals,University of Virginia,"65,000",Beginner,,Business Finance
Coursera,Gestión de organizaciones efectivas,Pontificia Universidad Católica de Chile,"47,000",All Levels,,Business Finance
Coursera,Fundamentals of Project Planning and Management,University of Virginia,"120,000",Beginner,,Business Finance
Coursera,Fundamentos de Finanzas Empresariales,Universidad de los Andes,"110,000",Beginner,,Business Finance
Coursera,An Introduction to Consumer Neuroscience & Neuromarketing,Copenhagen Business School,"69,000",Beginner,,Business Finance
Coursera,Accounting for Decision Making,University of Michigan,"9,900",Intermediate,,Business Finance
Coursera,Introduction to Operations Management,University of Pennsylvania,"87,000",All Levels,,Business Finance
Coursera,"High Performance Collaboration: Leadership, Teamwork, and Negotiation",Northwestern University,"46,000",All Levels,,Business Finance
Coursera,Introduction to Corporate Finance,University of Pennsylvania,"130,000",All Levels,,Business Finance
Coursera,Corporate Strategy,UCL School of Management,"7,800",Beginner,,Business Finance
Coursera,Modeling Risk and Realities,University of Pennsylvania,"36,000",All Levels,,Business Finance
Coursera,Design-Led Strategy: Design thinking for business strategy and entrepreneurship,The University of Sydney,"19,000",Intermediate,,Business Finance
Coursera,Business Strategy,University of Virginia,"89,000",Beginner,,Business Finance
Coursera,Inspiring and Motivating Individuals,University of Michigan,"85,000",All Levels,,Business Finance
Coursera,Finance for Non-Finance Professionals,Rice University,"69,000",Beginner,,Business Finance
Coursera,Corporate Sustainability. Understanding and Seizing the Strategic Opportunity,Università Bocconi,"10,000",All Levels,,Business Finance
Coursera,Operations Analytics,University of Pennsylvania,"80,000",All Levels,,Business Finance
Coursera,Cost and Economics in Pricing Strategy,University of Virginia,"15,000",Beginner,,Business Finance
Coursera,Costos para los Negocios,Universidad de Chile,"43,000",Intermediate,,Business Finance
Coursera,"FinTech: Foundations, Payments, and Regulations",University of Pennsylvania,"12,000",Beginner,,Business Finance
Coursera,International Leadership and Organizational Behavior,Università Bocconi,"41,000",All Levels,,Business Finance
Coursera,Entrepreneurship,University of Pennsylvania,"110,000",Beginner,,Business Finance
Coursera,Corporate Strategy,UCL School of Management,"7,800",Beginner,,Business Finance
Coursera,Marketing Verde,Universidad de los Andes,"58,000",All Levels,,Business Finance
Coursera,Influencer Marketing Strategy,Rutgers the State University of New Jersey,"12,000",Intermediate,,Business Finance
Coursera,Python and Statistics for Financial Analysis,The Hong Kong University of Science and Technology,"41,000",Intermediate,,Business Finance
Coursera,"Recruiting, Hiring, and Onboarding Employees",University of Minnesota,"35,000",All Levels,,Business Finance
Coursera,Contabilidad para no contadores,Universidad Nacional Autónoma de México,"220,000",Beginner,,Business Finance
Coursera,¿Qué hacen los buenos directivos? Prioridades de la Alta Dirección,IESE Business School,"25,000",Beginner,,Business Finance
Coursera,Introduction to Business Analytics: Communicating with Data,University of Illinois at Urbana-Champaign,"14,000",Intermediate,,Business Finance
Coursera,Intercultural Management,ESCP Business School,"6,500",Beginner,,Business Finance
Coursera,Camino a la Excelencia en Gestión de Proyectos,Pontificia Universidad Católica de Chile,"340,000",Beginner,,Business Finance
Coursera,Mastering Final Cut Pro,LearnQuest,"8,400",Beginner,,Business Finance
Coursera,Introduction to Blockchain Technologies,INSEAD,"16,000",Beginner,,Business Finance
Coursera,Private Equity and Venture Capital,Università Bocconi,"79,000",All Levels,,Business Finance
Coursera,Finance for Non-Financial Managers,Emory University,"12,000",Intermediate,,Business Finance
Coursera,Global Financial Markets and Instruments,Rice University,"37,000",All Levels,,Business Finance
Coursera,Accounting Analytics,University of Pennsylvania,"80,000",All Levels,,Business Finance
Coursera,Financing and Investing in Infrastructure,Università Bocconi,"24,000",All Levels,,Business Finance
Coursera,Becoming a changemaker: Introduction to Social Innovation,University of Cape Town,"61,000",Beginner,,Business Finance
Coursera,Negociación exitosa: Estrategias y habilidades esenciales (en español),University of Michigan,"95,000",All Levels,,Business Finance
Coursera,Financial Engineering and Risk Management Part I,Columbia University,"100,000",All Levels,,Business Finance
Coursera,Global Financing Solutions  (by EDHEC and Société Générale),EDHEC Business School,"3,600",Intermediate,,Business Finance
Coursera,Search Engine Optimization Fundamentals,"University of California, Davis","47,000",All Levels,,Business Finance
Coursera,Corporate & Commercial Law I: Contracts & Employment Law,University of Illinois at Urbana-Champaign,"10,000",Intermediate,,Business Finance
Coursera,Introduction to Marketing,University of Pennsylvania,"220,000",All Levels,,Business Finance
Coursera,People Analytics,University of Pennsylvania,"84,000",All Levels,,Business Finance
Coursera,Management of Fashion and Luxury Companies,Università Bocconi,"120,000",All Levels,,Business Finance
Coursera,"Advanced Valuation and Strategy - M&A, Private Equity, and Venture Capital",Erasmus University Rotterdam,"29,000",Advanced,,Business Finance
Coursera,International Organizations Management,University of Geneva,"20,000",Beginner,,Business Finance
Coursera,Legal Tech & Startups,IE Business School,"7,200",Intermediate,,Business Finance
Coursera,Strategic Business Management - Microeconomics,"University of California, Irvine","9,500",Beginner,,Business Finance
Coursera,Digital Media and Marketing Strategies,University of Illinois at Urbana-Champaign,"57,000",All Levels,,Business Finance
Coursera,Viral Marketing and How to Craft Contagious Content,University of Pennsylvania,"150,000",All Levels,,Business Finance
Coursera,Entrepreneurship 2: Launching your Start-Up,University of Pennsylvania,"38,000",All Levels,,Business Finance
Coursera,Budgeting and Scheduling Projects,"University of California, Irvine","84,000",All Levels,,Business Finance
Coursera,Food & Beverage Management,Università Bocconi,"57,000",All Levels,,Business Finance
Coursera,Scaling Operations: Linking Strategy and Execution,Northwestern University,"12,000",All Levels,,Business Finance
Coursera,Supply Chain Logistics,Rutgers the State University of New Jersey,"66,000",Beginner,,Business Finance
Coursera,Preparing to Manage Human Resources,University of Minnesota,"68,000",All Levels,,Business Finance
Coursera,"Brand Management: Aligning Business, Brand and Behaviour",London Business School,"57,000",Beginner,,Business Finance
Coursera,Communication Strategies for a Virtual Age,University of Toronto,"43,000",Beginner,,Business Finance
Coursera,Les Fondamentaux de la Négociation,ESSEC Business School,"10,000",Beginner,,Business Finance
Coursera,Successful Negotiation: Essential Strategies and Skills,University of Michigan,"750,000",All Levels,,Business Finance
Coursera,Healthcare Marketplace,University of Minnesota,"36,000",Beginner,,Business Finance
Coursera,Réussir le Changement,ESSEC Business School,"33,000",All Levels,,Business Finance
Coursera,Introduction to Portfolio Construction and Analysis with Python,EDHEC Business School,"11,000",All Levels,,Business Finance
Coursera,Building Your Leadership Skills,HEC Paris,"67,000",All Levels,,Business Finance
Coursera,Patrocinio Deportivo,Universitat Autònoma de Barcelona,"12,000",Beginner,,Business Finance
Coursera,Business Transformation with Google Cloud,Google Cloud,"10,000",Beginner,,Business Finance
Coursera,Entrepreneurship 3: Growth Strategies,University of Pennsylvania,"31,000",Beginner,,Business Finance
Coursera,The hidden value – Lean in manufacturing and services,École des Ponts ParisTech,"14,000",Beginner,,Business Finance
Coursera,Diseño y Creación de un Emprendimiento Social,Pontificia Universidad Católica de Chile,"21,000",Beginner,,Business Finance
Coursera,Social Entrepreneurship,Copenhagen Business School,"13,000",Beginner,,Business Finance
Coursera,Excel Skills for Business: Advanced,Macquarie University,"39,000",Intermediate,,Business Finance
Coursera,Foundations of Everyday Leadership,University of Illinois at Urbana-Champaign,"62,000",All Levels,,Business Finance
Coursera,Customer Segmentation and Prospecting,Northwestern University,"18,000",Beginner,,Business Finance
Coursera,Managing Social and Human Capital,University of Pennsylvania,"27,000",Beginner,,Business Finance
Coursera,Formulación y evaluación de proyectos complejos,Universidad de los Andes,"4,400",Intermediate,,Business Finance
Coursera,FinTech Law and Policy,Duke University,"9,700",Beginner,,Business Finance
Coursera,Initiating and Planning Projects,"University of California, Irvine","180,000",All Levels,,Business Finance
Coursera,Excel Skills for Business: Intermediate II,Macquarie University,"39,000",Intermediate,,Business Finance
Coursera,Financial Acumen for Non-Financial Managers,University of Pennsylvania,"10,000",Beginner,,Business Finance
Coursera,Six Sigma and the Organization (Advanced),University System of Georgia,"15,000",Intermediate,,Business Finance
Coursera,Construction Cost Estimating and Cost Control,Columbia University,"19,000",Beginner,,Business Finance
Coursera,Business Writing,University of Colorado Boulder,"48,000",Beginner,,Business Finance
Coursera,Agile ? Scrum ? ?????? ??? ????????? ? ??????????,ScrumTrek,"12,000",Beginner,,Business Finance
Coursera,Managing Project Risks and Changes,"University of California, Irvine","71,000",All Levels,,Business Finance
Coursera,More Introduction to Financial Accounting,University of Pennsylvania,"40,000",All Levels,,Business Finance
Coursera,Entrepreneurship 1: Developing the Opportunity,University of Pennsylvania,"86,000",All Levels,,Business Finance
Coursera,Foundations of Business Strategy,University of Virginia,"63,000",Beginner,,Business Finance
Coursera,Strategy and Sustainability,IESE Business School,"11,000",Beginner,,Business Finance
Coursera,Behavioral Finance,Duke University,"55,000",All Levels,,Business Finance
Coursera,Innovation Management,Erasmus University Rotterdam,"40,000",Beginner,,Business Finance
Coursera,Digital Business Models,Lund University,"21,000",Beginner,,Business Finance
Coursera,Excel Skills for Business: Essentials,Macquarie University,"200,000",Beginner,,Business Finance
Coursera,Introduction to Financial Accounting,University of Pennsylvania,"200,000",All Levels,,Business Finance
Coursera,Project Execution,"University of California, Irvine","70,000",Beginner,,Business Finance
Coursera,Design and Make Infographics (Project-Centered Course),Michigan State University,"97,000",All Levels,,Business Finance
Coursera,Design Thinking for Innovation,University of Virginia,"240,000",Beginner,,Business Finance
Coursera,What is Compliance?,University of Pennsylvania,"6,200",All Levels,,Business Finance
Coursera,Engineering Project Management: Initiating and Planning,Rice University,"23,000",Beginner,,Business Finance
Coursera,Reporting extra-financier et stratégie RSE,ESSEC Business School,"5,200",Beginner,,Business Finance
Coursera,L'excellence opérationnelle en pratique,ESSEC Business School,"8,000",Beginner,,Business Finance
Coursera,Business Model Innovation,HEC Paris,"13,000",All Levels,,Business Finance
Coursera,"Ready, Set, Future! Introduction to Futures Thinking",Institute for the Future,"7,700",Beginner,,Business Finance
Coursera,Finanzas personales,Universidad Nacional Autónoma de México,"310,000",All Levels,,Business Finance
Coursera,Supply Chain Principles,Georgia Institute of Technology,"29,000",All Levels,,Business Finance
Coursera,Marketing in a Digital World,University of Illinois at Urbana-Champaign,"310,000",Beginner,,Business Finance
Coursera,Project Launch,"University of California, Irvine","190,000",Beginner,,Business Finance
Coursera,Teamwork Skills: Communicating Effectively in Groups,University of Colorado Boulder,"49,000",Beginner,,Business Finance
Coursera,Financial Markets,Yale University,"470,000",Beginner,,Business Finance
Coursera,Strategic Management,Copenhagen Business School,"58,000",All Levels,,Business Finance
Coursera,Excel Skills for Business: Intermediate I,Macquarie University,"76,000",Intermediate,,Business Finance
Coursera,AI For Everyone,deeplearning.ai,"350,000",Beginner,,Business Finance
Coursera,Supply Chain Analytics,Rutgers the State University of New Jersey,"7,900",Beginner,,Business Finance
Coursera,Effective Compliance Programs,University of Pennsylvania,"3,400",All Levels,,Business Finance
Coursera,Supply Chain Operations,Rutgers the State University of New Jersey,"24,000",Beginner,,Business Finance
Coursera,The Manager's Toolkit: A Practical Guide to Managing People at Work,"Birkbeck, University of London","47,000",All Levels,,Business Finance
Coursera,Getting Started with Google Sheets,Google Cloud,"18,000",Beginner,,Business Finance
Coursera,Marketing Digital,Universidad Austral,"39,000",Beginner,,Business Finance
Coursera,Marketing Digital,Universidade de São Paulo,"81,000",Beginner,,Business Finance
Coursera,Driving business towards the Sustainable Development Goals,Erasmus University Rotterdam,"5,600",Beginner,,Business Finance
Coursera,Sports Marketing,Northwestern University,"12,000",Intermediate,,Business Finance
Coursera,Construction Scheduling,Columbia University,"15,000",Beginner,,Business Finance
Coursera,Renewable Energy and Green Building Entrepreneurship,Duke University,"24,000",Beginner,,Business Finance
Coursera,Boosting Creativity for Innovation,HEC Paris,"9,500",Beginner,,Business Finance
Coursera,Leadership in 21st Century Organizations,Copenhagen Business School,"34,000",All Levels,,Business Finance
Udemy,Ultimate Investment Banking Course,,2147,All Levels,2017-01-18T20:58:58Z,Business Finance
Udemy,Complete GST Course & Certification - Grow Your CA Practice,,2792,All Levels,2017-03-09T16:34:20Z,Business Finance
Udemy,Financial Modeling for Business Analysts and Consultants,,2174,Intermediate,2016-12-19T19:26:30Z,Business Finance
Udemy,Beginner to Pro - Financial Analysis in Excel 2017,,2451,All Levels,2017-05-30T20:07:24Z,Business Finance
Udemy,How To Maximize Your Profits Trading Options,,1276,Intermediate,2016-12-13T14:57:18Z,Business Finance
Udemy,Trading Penny Stocks: A Guide for All Levels In 2017,,9221,All Levels,2014-05-02T15:13:30Z,Business Finance
Udemy,Investing And Trading For Beginners: Mastering Price Charts,,1540,Beginner,2016-02-21T18:23:12Z,Business Finance
Udemy,"Trading Stock Chart Patterns For Immediate, Explosive Gains",,2917,All Levels,2015-01-30T22:13:03Z,Business Finance
Udemy,Options Trading 3 : Advanced Stock Profit and Success Method,,5172,Advanced,2015-05-28T00:14:03Z,Business Finance
Udemy,The Only Investment Strategy You Need For Your Retirement,,827,All Levels,2017-04-18T18:13:32Z,Business Finance
Udemy,Forex Trading Secrets of the Pros With Amazon's AWS,,4284,All Levels,2015-09-11T16:47:02Z,Business Finance
Udemy,Trading Options With Money Flow,,1380,All Levels,2016-10-18T22:52:31Z,Business Finance
Udemy,Financial Management Risk and Return For Securities,,3607,All Levels,2016-02-03T18:04:01Z,Business Finance
Udemy,Forex Trading Course: Work Smarter Not Harder Proven Results,,4061,All Levels,2016-03-16T15:40:19Z,Business Finance
Udemy,Python Algo Trading: Sentiment Trading with News,,294,All Levels,2017-04-28T16:41:44Z,Business Finance
Udemy,Short Selling: Learn To Sell Stocks Before The Fall,,2276,Intermediate,2015-06-22T21:18:35Z,Business Finance
Udemy,Basic Technical Analysis: Learn the structure of the market,,4919,Beginner,2016-01-08T17:21:26Z,Business Finance
Udemy,The Complete Chart Pattern Trading Course: A Proven Approach,,2666,All Levels,2015-08-10T21:07:35Z,Business Finance
Udemy,7 Deadly Mistakes of Investing that Will Slash Your Profits!,,5354,All Levels,2015-09-21T18:10:34Z,Business Finance
Udemy,Financial Statements Made Easy,,8095,Beginner,2013-06-09T00:21:26Z,Business Finance
Udemy,Winning Forex Trading with Live Forex Trading Examples,,809,All Levels,2017-06-06T02:54:04Z,Business Finance
Udemy,Forex Traders - Create Your First Trading Robot. No Coding!,,2295,All Levels,2016-05-02T19:26:48Z,Business Finance
Udemy,Create A Business From Home Trading Stocks Today In 2017,,10149,All Levels,2015-05-26T17:25:46Z,Business Finance
Udemy,Introduction to Accounting : Mastering Financial Statements,,1916,Beginner,2016-12-05T22:14:17Z,Business Finance
Udemy,The Complete Ethereum Course: Get .01 Ether In Your Wallet,,2507,All Levels,2016-05-30T18:53:46Z,Business Finance
Udemy,Beginner to Pro in PowerPoint: Complete PowerPoint Training,,5786,All Levels,2015-01-31T15:34:05Z,Business Finance
Udemy,Investing 101: The Complete Online Investing Course,,5334,All Levels,2014-11-28T17:49:03Z,Business Finance
Udemy,Create Your Own Hedge Fund: Trade Stocks Like A Fund Manager,,4005,Intermediate,2015-04-12T20:13:47Z,Business Finance
Udemy,Learn MQL5: Build an 8-Currency Hedging Robot (MetaTrader 5),,2877,All Levels,2016-04-26T22:41:46Z,Business Finance
Udemy,Forex Trading: Your Complete Guide to Get Started Like a Pro,,1026,Beginner,2017-06-27T22:21:31Z,Business Finance
