Platform,course_title,Institution,num_subscribers,level,published_timestamp,subject
Udemy,PHP: Complete Login and Registration System with PHP & MYSQL,,1448,All Levels,2015-06-16T20:38:45Z,Computer Science
Udemy,JavaScript Complete Guide to learning JavaScript,,1296,Beginner,2016-05-17T17:19:48Z,Computer Science
Udemy,Advanced Scalable Python Web Development Using Flask,,1299,Intermediate,2016-08-11T22:09:24Z,Computer Science
Udemy,jQuery for Absolute Beginners - Lite,,1769,All Levels,2015-12-30T20:13:46Z,Computer Science
Udemy,HTML Complete Course - Beginner to Expert,,20073,All Levels,2016-02-29T00:15:42Z,Computer Science
Udemy,Cross-Platform Development with ASP.NET Core 1.0 MVC,,601,All Levels,2016-07-11T18:57:34Z,Computer Science
Udemy,Build a Photo Blog with Ruby on Rails,,2281,Intermediate,2015-04-02T20:30:12Z,Computer Science
Udemy,Practical PHP: Master the Basics and Code Dynamic Websites,,83737,All Levels,2014-07-19T03:02:05Z,Computer Science
Udemy,Sass Workflow,,20890,Beginner,2015-02-06T15:54:23Z,Computer Science
Udemy,Learn PHP Fundamentals From Scratch,,48650,Beginner,2013-10-16T08:12:40Z,Computer Science
Udemy,XML For Absolute Beginners: Learn to create your own tags,,1945,Beginner,2015-12-17T17:27:32Z,Computer Science
Udemy,Joomla: Create a Joomla Website This Weekend With NO CODING!,,18496,Beginner,2014-10-06T20:19:00Z,Computer Science
Udemy,JavaScript for beginners - A Complete Guide,,1193,All Levels,2015-06-16T00:35:45Z,Computer Science
Udemy,Laravel Deployment - Launch your Laravel Application Online,,4905,Intermediate,2016-10-22T20:12:05Z,Computer Science
Udemy,WordPress Development Crash Course: From Zero To Hero,,1699,All Levels,2016-02-01T22:07:26Z,Computer Science
Udemy,Learn how to create a WordPress theme using Pinegrow,,11812,Intermediate,2015-07-27T18:26:45Z,Computer Science
Udemy,Learn to Build Web Apps using Laravel Framework,,746,All Levels,2015-11-10T22:15:21Z,Computer Science
Udemy,Flexbox: The complete guide,,189,All Levels,2017-06-09T23:29:48Z,Computer Science
Udemy,How to Safely Copy and Move Your WordPress Website,,1419,Intermediate,2014-11-05T13:21:19Z,Computer Science
Udemy,AngularJs :basics for beginners,,1237,All Levels,2016-09-19T14:50:49Z,Computer Science
Udemy,JSON For Beginners: A Very Basic Introduction,,1703,Beginner,2016-01-18T23:06:45Z,Computer Science
Udemy,Learn SASS and improve your CSS,,1849,All Levels,2014-12-20T00:21:05Z,Computer Science
Udemy,Angular Tutorial For Beginners,,5397,Beginner,2017-02-28T04:07:50Z,Computer Science
Udemy,HTML and CSS for Absolute Beginners,,4410,All Levels,2017-01-20T17:02:27Z,Computer Science
Udemy,"JavaScript, jQuery and Ajax",,1554,All Levels,2016-02-02T18:36:12Z,Computer Science
Udemy,Laravel Blog Development Starter,,4499,All Levels,2017-02-14T00:38:18Z,Computer Science
Udemy,React: Learn ReactJS Fundamentals for Front-End Developers,,1993,All Levels,2016-06-06T15:29:42Z,Computer Science
Udemy,JavaScript For Absolute Beginners - Level Two,,424,Intermediate,2016-09-20T17:59:39Z,Computer Science
Udemy,How To Create A Real Estate Website With Wordpress 2017,,3782,Beginner,2017-06-06T14:10:36Z,Computer Science
Udemy,The Complete HTML5 and CSS3 Course - with 8 Websites Design,,1551,All Levels,2015-12-07T19:32:22Z,Computer Science
Udemy,Introduction to Modern Programming with PHP,,954,Beginner,2015-08-27T19:20:42Z,Computer Science
Udemy,HTML Introduction Course: Learn HTML in 2 hours!!!,,7304,All Levels,2016-03-08T15:24:31Z,Computer Science
Udemy,Learn HTML & CSS: How To Start Your Web Development Career,,15462,Beginner,2015-09-29T19:46:45Z,Computer Science
Udemy,React vs Angular vs Vue.js by Example,,6958,Beginner,2017-06-02T21:57:07Z,Computer Science
Udemy,Create WordPress Plugins,,964,All Levels,2016-04-08T21:24:12Z,Computer Science
Udemy,Build and Deploy a LAMP server on AWS,,3571,Beginner,2017-06-19T23:33:54Z,Computer Science
Udemy,Build your own Beautiful Blog in WordPress + SEO,,2421,All Levels,2015-11-25T18:00:35Z,Computer Science
Udemy,AngularJS Authentication: Secure Your App with Auth0,,21689,All Levels,2016-04-01T05:51:48Z,Computer Science
Udemy,Learn Bootstrap 4 by Example,,5542,All Levels,2017-06-12T20:30:50Z,Computer Science
Udemy,Complete WooCommerce Plugin Tutorial For Wordpress 2017,,7922,Beginner,2017-01-27T16:47:14Z,Computer Science
Udemy,How To Build And Make A Wordpress Website From Scratch 2017,,7055,All Levels,2017-01-24T04:59:20Z,Computer Science
Udemy,Docker for Developers - Newest Version 1.12 with Swarm Mode,,767,Beginner,2016-07-22T15:37:25Z,Computer Science
Udemy,Angular Material - Quickstart,,3766,Beginner,2017-03-09T22:12:32Z,Computer Science
Udemy,HTML and CSS for Beginners - Build a Website & Launch ONLINE,,70773,All Levels,2015-03-19T19:07:12Z,Computer Science
Udemy,"Core: A Web App Reference Guide for Django, Python, and More",,2497,All Levels,2014-05-29T00:58:43Z,Computer Science
Udemy,"JSON with Java APIs, jQuery and JSON REST Web Services",,799,Beginner,2016-05-30T23:54:43Z,Computer Science
Udemy,Bootstrap 4 Quick Start: Code Modern Responsive Websites,,41478,All Levels,2015-12-30T21:28:31Z,Computer Science
Udemy,Learn Symfony 3 framework by practical examples,,867,All Levels,2016-09-19T21:05:38Z,Computer Science
Udemy,"Complete Web Development with HTML, CSS and Javascript",,2097,Intermediate,2017-06-27T21:49:31Z,Computer Science
Udemy,Web Hosting Introduction: How to Publish Your Website Online,,5533,Beginner,2015-02-09T00:55:50Z,Computer Science
Udemy,Django For Beginners,,534,Beginner,2016-08-23T18:49:41Z,Computer Science
Udemy,Introduction to QGIS Python Programming,,197,Beginner,2016-12-22T00:11:22Z,Computer Science
Udemy,Learning Object-Oriented JavaScript,,533,Intermediate,2015-02-17T09:53:12Z,Computer Science
Udemy,Bootstrap Tutorial for Beginners,,1036,Beginner,2016-02-21T16:50:57Z,Computer Science
Udemy,Learn Bootstrap3 With Multi Purposes Single Page Layout,,4503,All Levels,2016-02-16T21:59:01Z,Computer Science
Udemy,HTML for Beginners,,8592,Beginner,2013-07-20T00:52:41Z,Computer Science
Udemy,How to Build WordPress Themes: A Web Designer's Guide,,183,Intermediate,2017-03-31T23:56:08Z,Computer Science
Udemy,XML DTD :basics for beginners,,903,All Levels,2016-09-26T16:52:50Z,Computer Science
Udemy,Learn to make an HTML 5 website with a video background,,1236,All Levels,2015-06-05T18:13:08Z,Computer Science
Udemy,Learn Authentication With ASP.NET Identity Security 2017,,305,All Levels,2016-02-26T17:41:37Z,Computer Science
Udemy,HTML and CSS Foundations,,1544,Beginner,2017-06-23T16:51:54Z,Computer Science
Udemy,Python Web Programming,,1020,Beginner,2015-07-01T21:46:36Z,Computer Science
Udemy,Build a Complete Registration and Login System using PHP MVC,,325,All Levels,2017-02-23T22:20:23Z,Computer Science
Udemy,ES6 / EcmaScript 6 for beginners an introduction,,3227,Intermediate,2017-06-22T22:01:11Z,Computer Science
Udemy,React for visual learners,,659,All Levels,2016-07-18T21:41:36Z,Computer Science
Udemy,Learn to Create Advance Responsive Websites With Bootstrap,,2528,All Levels,2014-10-26T09:54:16Z,Computer Science
Udemy,Master the Art of Web Design with HTML & CSS,,550,All Levels,2016-12-28T20:23:56Z,Computer Science
Udemy,Sell Courses On Your Own Website - No Coding Required!,,1032,All Levels,2016-04-18T17:36:30Z,Computer Science
Udemy,Implementing a Data Warehouse with SQL Server 2012 ,,1142,All Levels,2015-05-01T23:08:38Z,Computer Science
Udemy,Learning 200 jQuery Functions with 800 Examples,,1766,All Levels,2015-02-24T22:57:40Z,Computer Science
Udemy,Create Complete Web Applications easily with APEX 5,,912,Intermediate,2015-07-14T20:30:11Z,Computer Science
Udemy,"Learn Gulp, The Streaming Build System",,1305,All Levels,2015-04-19T20:34:42Z,Computer Science
Udemy,Perfect React JS Course - Understand Relevant Details,,653,Beginner,2017-01-17T05:40:31Z,Computer Science
Udemy,Create a classified website in 2 hours - guaranteed,,3411,All Levels,2013-11-09T09:36:07Z,Computer Science
Udemy,Learn HTML And CSS From Scratch,,11533,Beginner,2016-02-19T15:50:39Z,Computer Science
Udemy,Become a Certified Web Developer - Beginner to Expert,,3397,All Levels,2015-04-06T16:38:49Z,Computer Science
Udemy,Complete Bootstrap 4 course - build 3 projects,,7865,All Levels,2017-04-07T17:26:02Z,Computer Science
Udemy,Up and Running with Phalcon,,715,All Levels,2016-11-10T15:33:54Z,Computer Science
Udemy,HTML : HTML Awesomeness,,988,Beginner,2016-08-17T19:33:35Z,Computer Science
Udemy,Build CRUD Application - PHP & Mysql,,4405,Beginner,2017-05-04T16:47:24Z,Computer Science
Udemy,All You Need To Know About AngularJS - Training On AngularJS,,1936,All Levels,2014-03-07T19:09:28Z,Computer Science
Udemy,PSD To a Creative Landing Page Using Twitter Bootstrap 3,,11666,Beginner,2016-04-07T00:04:27Z,Computer Science
Udemy,Ready for Production with Spring Boot Actuator,,361,Intermediate,2017-01-05T17:48:41Z,Computer Science
Udemy,AngularJS For Beginners,,30531,All Levels,2015-06-30T20:28:22Z,Computer Science
Udemy,Learning Path: Akka: Building Applications and Microservices,,88,Intermediate,2017-05-04T00:35:35Z,Computer Science
Udemy,Set up a localhost Web Server for Faster Website Development,,55,All Levels,2017-06-12T15:12:19Z,Computer Science
Udemy,Mastering Meteor: Reactive Full Stack JavaScript,,494,Advanced,2015-12-10T18:16:09Z,Computer Science
Udemy,Build A Professional Wordpress Website In An Hour,,1294,All Levels,2014-12-31T04:42:49Z,Computer Science
Udemy,Build a file hosting/sharing site in less than 2 hours ,,976,All Levels,2014-07-14T18:43:39Z,Computer Science
Udemy,Introduction to Java Programming for Online Learners,,1586,Beginner,2013-04-17T02:55:10Z,Computer Science
Udemy,Create full featured Landing Page in Ruby on Rails in 3 hour,,1550,All Levels,2015-05-15T18:53:55Z,Computer Science
Udemy,How to create a  video blog with WordPress,,1209,All Levels,2016-03-29T17:43:26Z,Computer Science
Udemy,PHP For WordPress Development,,850,Beginner,2016-04-12T18:00:47Z,Computer Science
Udemy,Create a Professional Website Without Programming/Coding,,5421,All Levels,2015-01-17T09:15:37Z,Computer Science
Udemy,How to Build an Autocomplete System Like Google,,255,All Levels,2016-10-12T23:24:28Z,Computer Science
Udemy,Master EmberJS : Learn Ember JS From Scratch,,707,All Levels,2015-07-10T21:24:15Z,Computer Science
Udemy,How To Make A Modern Wordpress BLOG 2017! Create Your Blog!,,6856,Beginner,2016-11-29T23:01:43Z,Computer Science
Udemy,Learn Top Ten PHP FrameWorks By Building Projects,,1007,All Levels,2016-01-27T18:05:12Z,Computer Science
Udemy,How to Make a Video Blog Website From Scratch w/ Wordpress ,,12952,All Levels,2015-10-21T23:31:22Z,Computer Science
Udemy,Build Websites And Apps By Outsourcing,,2299,All Levels,2015-07-20T22:16:39Z,Computer Science
Udemy,Learning Path: Web Applications with Spring and Angular,,19,Advanced,2017-06-28T21:04:21Z,Computer Science
Udemy,Learn Ruby on Rails By Building Projects,,1736,All Levels,2014-11-12T09:33:28Z,Computer Science
Udemy,Canvas image Creator HTML5 JavaScript project from Scratch,,2195,Intermediate,2016-03-06T21:41:43Z,Computer Science
Udemy,Javascript Essentials,,47062,Beginner,2016-01-20T19:08:27Z,Computer Science
Udemy,Devtools 2017: The Basics of Chrome Developer Tools,,4569,Beginner,2017-04-14T16:58:12Z,Computer Science
Udemy,Chrome Extensions : Develop 5 chrome extensions from scratch,,3655,Beginner,2017-03-30T15:22:46Z,Computer Science
Udemy,Learn how to quickly build websites using Wordpress,,15715,All Levels,2014-12-18T12:50:07Z,Computer Science
Udemy,Advance Unix : File Processing: AWK | SED | GREP | CUT | VIM,,578,Advanced,2017-01-27T05:12:57Z,Computer Science
Udemy,Develop a Professional OnePage WordPress site With No Coding,,1747,Beginner,2016-08-29T16:47:15Z,Computer Science
Udemy,PHP Specialist (2017 Edition),,197,Beginner,2017-03-28T23:39:37Z,Computer Science
Udemy,Python Programming: Create an Digital Marketplace in Django,,4198,All Levels,2013-10-20T19:53:28Z,Computer Science
Udemy,Create Ajax Chat App with PHP & Mysql,,540,Beginner,2017-04-15T00:56:41Z,Computer Science
Udemy,Mastering Thymeleaf with Spring,,942,All Levels,2016-02-05T20:42:25Z,Computer Science
Udemy,Learn Rails Programming in Less than 2 Hours,,2470,All Levels,2015-09-23T02:21:50Z,Computer Science
Udemy,Wordpress Backup & Restore,,478,All Levels,2016-09-15T17:20:21Z,Computer Science
Udemy,Learn JavaScript Dynamic Interactive Projects for Beginners,,2558,Beginner,2016-02-14T18:51:48Z,Computer Science
Udemy,Build Modern Websites Super Fast,,2178,All Levels,2016-03-10T00:04:59Z,Computer Science
Udemy,SAP - Learn SAPUI5 Professional Development,,860,All Levels,2016-04-25T15:22:50Z,Computer Science
Udemy,Wordpress Security,,2888,All Levels,2015-04-13T17:53:02Z,Computer Science
Udemy,Learn HTML5 At Your Own Pace. Ideal for Beginners,,3026,All Levels,2012-02-28T18:52:32Z,Computer Science
Udemy,Build an Amazon clone: Nodejs + MongoDB + Stripe Payment,,2164,All Levels,2016-01-08T17:16:48Z,Computer Science
Udemy,Build Real World Websites from Scratch using HTML5 and CSS3,,10874,Beginner,2016-01-25T18:00:51Z,Computer Science
Udemy,How to become an App Developer,,1935,Beginner,2017-05-19T21:39:35Z,Computer Science
Udemy,"Modern JavaScript: Building Real-World, Real-Time Apps",,1871,Intermediate,2016-03-30T21:15:15Z,Computer Science
Udemy,JavaScript Introduction to Object Oriented JavaScript,,7789,Beginner,2015-10-01T17:43:34Z,Computer Science
Udemy,Core HTML How to get online quickly HTML to HTML5 ,,10394,Beginner,2015-08-21T18:53:23Z,Computer Science
Udemy,Building Websites JavaScript and the DOM,,17759,Beginner,2016-09-26T14:48:26Z,Computer Science
Udemy,Complete Login and Registration System in PHP and MYSQL,,4714,All Levels,2015-07-16T22:09:55Z,Computer Science
Udemy,The Complete E-Commerce Web Developer Course 5.0,,3209,All Levels,2016-09-13T16:12:58Z,Computer Science
Udemy,HTML5 canvas Bootcamp for beginners 25 easy steps,,14118,Beginner,2016-03-01T23:04:23Z,Computer Science
Udemy,Advanced HTML5 Tutorial for Web Developers,,11847,All Levels,2012-10-17T11:07:41Z,Computer Science
Udemy,Learn the Basics of Programming for Marketers,,11339,Beginner,2015-04-21T17:24:26Z,Computer Science
Udemy,Css For Beginners,,1156,Beginner,2015-10-21T20:14:34Z,Computer Science
Udemy,GRUNT js: Automate web development tasks and save your time,,1534,All Levels,2015-03-02T23:34:14Z,Computer Science
Udemy,Mastering Web and Mobile Debugging Using Chrome Dev Tools,,1102,All Levels,2016-01-29T21:02:49Z,Computer Science
Udemy,HTML : Beginner Guide to HTML writing,,783,Beginner,2016-07-28T18:50:58Z,Computer Science
Udemy,Build Web Apps Using EmberJS: The Complete Course,,627,All Levels,2015-12-10T18:01:55Z,Computer Science
Udemy,SharePoint 2013 Development using C# - Part I,,891,All Levels,2014-11-06T13:59:44Z,Computer Science
Udemy,SAP Crystal Reports with ASP.Net (Step by step),,7484,Beginner,2015-03-04T01:33:32Z,Computer Science
Udemy,Building Responsive Data Visualizations with D3 JS,,876,All Levels,2015-06-12T20:17:52Z,Computer Science
Udemy,Learn Rails Programming in Less than 30 Minute - Lite,,1235,All Levels,2016-01-06T17:49:01Z,Computer Science
Udemy,SASS - Beginner Crash Course,,1143,Beginner,2015-02-12T17:13:26Z,Computer Science
Udemy,Angular 2 Fundamentals for Web Developers,,450,All Levels,2016-04-14T18:43:47Z,Computer Science
Udemy,Easily Learn Web Development With Drop & Drag: OptimizePress,,1442,Beginner,2015-01-23T06:46:27Z,Computer Science
Udemy,XML XSLT - Crash Course for Beginners,,426,All Levels,2017-02-19T18:11:07Z,Computer Science
Udemy,Create Your Own Successful Online School To Sell Courses,,2814,Beginner,2014-11-18T04:02:55Z,Computer Science
Udemy,Flask Tutorial Step by Step,,4645,Intermediate,2017-02-28T16:27:45Z,Computer Science
Udemy,Ruby on Rails a Beginners Guide ,,13130,Beginner,2016-03-18T14:58:53Z,Computer Science
Udemy,Mastering Basic CSS Selectors.,,3933,Beginner,2017-05-09T22:13:22Z,Computer Science
Udemy,Create a Website Similar to Facebook from Scratch!,,2197,All Levels,2016-02-09T06:15:07Z,Computer Science
Udemy,Comprehensive TypeScript,,1318,All Levels,2015-04-13T19:00:50Z,Computer Science
Udemy,"Essential HTML, CSS & HTML5 Training",,1553,Beginner,2015-04-12T22:20:58Z,Computer Science
Udemy,HTML 5 and CSS 3 - tricks and workarounds,,2007,All Levels,2016-02-18T00:21:26Z,Computer Science
Udemy,"How to Register a Domain, Set Up Hosting, and Edit Web Pages",,1540,Beginner,2015-05-21T19:37:46Z,Computer Science
Udemy,WordPress Plugins Treasure Chest,,1655,Intermediate,2015-08-06T21:01:21Z,Computer Science
Udemy,Practical Understanding of PHP and MySQL,,12201,Beginner,2016-07-06T16:35:25Z,Computer Science
Udemy,"AngularJS for Beginners, Single-Page Applications Made Easy",,1284,All Levels,2014-11-18T06:03:56Z,Computer Science
Udemy,Building a Social Network in PHP & MySQL From Scratch,,869,All Levels,2015-03-17T16:54:15Z,Computer Science
Udemy,XML DOM - Crash Course for Beginners,,396,All Levels,2017-02-19T23:41:32Z,Computer Science
Udemy,Create a Powerful Website with the Cool Bootstrap Framework,,7142,All Levels,2016-02-02T23:35:43Z,Computer Science
Udemy,HTML5 and CSS3 -Start building beautiful websites,,1414,All Levels,2015-05-14T22:21:39Z,Computer Science
Udemy,Getting Started as a Web Developer,,9833,Beginner,2014-08-16T22:20:47Z,Computer Science
Udemy,Learn Laravel: Create Your Web App Step-By-Step,,604,All Levels,2015-05-20T19:48:45Z,Computer Science
Udemy,Professional Web Scraping with Java,,685,Intermediate,2016-05-16T00:11:41Z,Computer Science
Udemy,3D Programming with WebGL and Babylon.js for Beginners,,549,Intermediate,2015-08-31T21:07:26Z,Computer Science
Udemy,Learn to make a colorful one page website,,1220,All Levels,2015-06-05T18:09:58Z,Computer Science
Udemy,WordPress Plugin Tutorial,,1588,Beginner,2015-05-14T21:38:00Z,Computer Science
Udemy,Introduction to HTML,,8371,Beginner,2014-08-30T01:33:38Z,Computer Science
Udemy,Learn JavaScript From Scratch:Become Top Rated Web Developer,,2570,All Levels,2017-06-29T18:10:15Z,Computer Science
Udemy,"Installing Wordpress 4 - Installation, Registrars & Hosting",,6117,Beginner,2014-10-31T07:21:32Z,Computer Science
Udemy,Learn PHP Programming for Absolute Beginners,,5368,All Levels,2015-08-05T18:47:48Z,Computer Science
Udemy,WordPress for Beginners 2017 + Google AdSense Implementation,,2225,All Levels,2017-06-05T18:20:34Z,Computer Science
Udemy,JavaScript for beginners in 1 hour,,2086,Beginner,2016-12-12T16:52:38Z,Computer Science
Udemy,HTML5 and CSS for Beginner To Expert,,1732,All Levels,2017-06-06T22:27:23Z,Computer Science
Udemy,Become a Kick-Ass Web Developer: From Newbie to Pro,,6751,All Levels,2014-10-02T15:47:45Z,Computer Science
Udemy,Django Tutorial: Build Your First App Fast & Free! ,,5228,Beginner,2015-09-08T00:17:23Z,Computer Science
Udemy,Create a social network using PHP Mysqli HTML Css and JQuery,,1477,Intermediate,2017-04-24T00:18:42Z,Computer Science
Udemy,PHP - Send and Receive Mobile Text Messages (SMS),,1626,All Levels,2016-06-15T23:04:19Z,Computer Science
Udemy,Complete PHP Course with OOP Start to Finish!,,4529,All Levels,2015-11-26T22:25:33Z,Computer Science
Udemy,Coding Made Easy: HTML & CSS For Beginners,,3254,Beginner,2016-06-07T17:35:07Z,Computer Science
Udemy,WordPress Security - The Ultimate Security Guide,,2267,All Levels,2015-01-04T20:28:06Z,Computer Science
Udemy,How to Make a Single Page Website for Freelancers & Agencies,,17463,All Levels,2015-10-15T20:13:38Z,Computer Science
Udemy,Learn to Use jQuery UI Widgets,,23669,Beginner,2013-06-23T02:38:19Z,Computer Science
Udemy,Learn to Create Responsive Layouts in 30 Minutes,,5301,Beginner,2017-01-17T22:26:51Z,Computer Science
Udemy,Web Building Starter Pack. Html Css and JQuery Animations,,1033,All Levels,2016-10-07T21:58:04Z,Computer Science
Udemy,Getting Started with Angular 2+,,6909,Beginner,2017-04-27T22:25:40Z,Computer Science
Udemy,Intro to PHP Web Application Development with Symfony,,4040,Beginner,2013-09-06T02:34:20Z,Computer Science
Udemy,Learn OAuth 2.0 - Theory and Hands On,,546,All Levels,2016-10-17T22:18:40Z,Computer Science
Udemy,Learning CSS3 - A Comprehensive Tutorial For Web Developers,,2459,All Levels,2012-05-24T21:14:57Z,Computer Science
Udemy,Professional WordPress Theme Development from Scratch,,1284,All Levels,2015-10-13T00:41:30Z,Computer Science
Udemy,PHP Zend Framework 1.11:Creating a CRUD Application,,1122,All Levels,2016-11-24T04:49:57Z,Computer Science
Udemy,Write quicker HTML5 and CSS 3; productivity hacks with emmet,,13016,All Levels,2016-03-03T17:45:31Z,Computer Science
Udemy,The Ultimate jQuery Course,,1098,All Levels,2015-11-13T19:37:48Z,Computer Science
Udemy,Build an Advanced Single Page with Bootstrap & WordPress,,481,Intermediate,2015-04-08T16:23:36Z,Computer Science
Udemy,Master all PHP ideas 2017 to build any project,,376,Beginner,2017-02-12T17:54:34Z,Computer Science
Udemy,A Beginner's Guide to the Meteor JavaScript Framework,,898,Beginner,2014-09-27T02:27:57Z,Computer Science
Udemy,Create an E-commerce website without any coding,,1393,All Levels,2014-12-18T00:04:38Z,Computer Science
Udemy,Learn To Build Apps Using Play Framework,,434,All Levels,2016-06-07T17:38:29Z,Computer Science
Udemy,Introducing Ionic 2,,394,Beginner,2016-02-08T20:43:47Z,Computer Science
Udemy,Learn Laravel with Database Migration & Seeding & Faker,,263,All Levels,2017-01-09T16:39:16Z,Computer Science
Udemy,Create a Client Network by Hosting WordPress Sites,,1061,Intermediate,2015-03-02T21:42:06Z,Computer Science
Udemy,Introduction to PHP Slim Microframework,,1312,Intermediate,2015-08-07T16:53:35Z,Computer Science
Udemy,ASP :basics for beginners,,764,All Levels,2016-09-29T15:52:42Z,Computer Science
Udemy,"WordPress Development With NodeJS, Gulp, Composer & More",,289,Intermediate,2016-10-25T13:47:26Z,Computer Science
Udemy,Become PHP Facebook Developer: Password-Less Authentication,,4001,All Levels,2017-05-07T19:30:36Z,Computer Science
Udemy,How To Create Your Very First Website With HTML and CSS,,5097,Beginner,2016-04-09T01:56:01Z,Computer Science
Udemy,Learn JSON for beginners with JavaScript,,3193,Beginner,2017-06-30T17:40:02Z,Computer Science
Udemy,Ultimate guide to Social Media Web development integration ,,11011,All Levels,2015-09-20T18:13:38Z,Computer Science
Udemy,A Complete Laravel basics from beginner to expert,,3492,All Levels,2016-12-06T22:07:53Z,Computer Science
Udemy,JQuery Basics - Learn JQuery From Scratch,,3559,Beginner,2017-06-18T21:23:07Z,Computer Science
Udemy,Learn MeteorJS By Building 10 Real World Projects,,2784,All Levels,2015-07-28T17:23:14Z,Computer Science
Udemy,JavaScript Basics for Beginners Introduction to coding,,5495,Beginner,2016-02-17T04:53:50Z,Computer Science
Udemy,AngularJS Masterclass - Deep Dive & Understand AngularJS,,2912,All Levels,2015-03-04T22:52:26Z,Computer Science
Udemy,HTML5 for beginners,,9687,Beginner,2015-04-24T18:04:21Z,Computer Science
Udemy,All in one HTML CSS and JQuery,,3444,All Levels,2017-01-27T22:27:20Z,Computer Science
Udemy,Responsive Design with NEW Materialize,,12629,All Levels,2015-07-23T20:03:45Z,Computer Science
Udemy,Create a Responsive Business Website with WordPress,,1659,All Levels,2013-03-25T01:44:54Z,Computer Science
Udemy,PHP webservices,,1305,All Levels,2016-08-31T16:41:53Z,Computer Science
Udemy,JavaScript Promises: Applications in ES6 and AngularJS,,651,Beginner,2015-11-06T19:02:46Z,Computer Science
Udemy,Learn to build 20 websites and build 14 iOS9 apps with swift,,1926,All Levels,2015-07-24T21:45:40Z,Computer Science
Udemy,Professional CSS Flexbox,,396,Intermediate,2016-04-07T23:21:42Z,Computer Science
Udemy,XML :basics for beginners,,1062,All Levels,2016-09-26T16:38:41Z,Computer Science
Udemy,How to create Paypal and Credit card Payment Buttons,,578,Beginner,2016-11-17T20:57:25Z,Computer Science
Udemy,Customizr - Learn WordPress with the ultimate creative theme,,4735,Beginner,2016-05-05T19:08:34Z,Computer Science
Udemy,How To Create a Local Wordpress Environment,,4306,Beginner,2016-02-07T18:58:40Z,Computer Science
Udemy,Fun and creative web engineering with Python and Web2py,,10917,All Levels,2015-06-09T19:51:50Z,Computer Science
Udemy,WordPress for Beginners - Build Your First Website in 2017,,1701,Beginner,2015-06-23T20:16:55Z,Computer Science
Udemy,Learn to Make an Animated Image Gallery using HTML5,,11080,Beginner,2014-11-20T11:37:05Z,Computer Science
Udemy,Projects in Foundation Framework - Learn By Building 10 Apps,,636,All Levels,2015-07-27T20:56:27Z,Computer Science
Udemy,Drupal for Beginners,,1478,Beginner,2015-01-26T06:54:58Z,Computer Science
Udemy,Laravel : CRUD Application Using AJAX In Laravel 5.3,,362,Intermediate,2017-01-09T16:52:33Z,Computer Science
Udemy,Foundations of Front-End Web Development,,8337,Beginner,2014-12-12T21:47:15Z,Computer Science
Udemy,Angular 2 - Superheroic Framework,,702,Beginner,2016-05-04T16:35:07Z,Computer Science
Udemy,Social Network Web Development,,2698,All Levels,2013-09-03T06:29:24Z,Computer Science
Udemy,For Free - Deploy Quickly Spring Boot on Heroku With MySQL,,177,All Levels,2016-08-06T07:33:17Z,Computer Science
Udemy,Building Web Applications with Spring MVC,,714,All Levels,2014-12-09T13:34:19Z,Computer Science
Udemy,"HTML5, CSS3 & Bootstrap - How to Create a Responsive Website",,1062,All Levels,2015-07-31T23:56:22Z,Computer Science
Udemy,HTML & CSS - Learn to build sleek websites ,,1552,All Levels,2014-10-21T03:35:47Z,Computer Science
Udemy,Master Angular 2 - The No Nonsense Course,,102,Beginner,2016-11-24T04:06:21Z,Computer Science
Udemy,Master ASP . NET 4 from scratch,,613,All Levels,2015-08-18T20:58:37Z,Computer Science
Udemy,CoffeeScript: The Good Partsâ€”Write Better javaScript,,2152,Beginner,2015-01-13T04:50:51Z,Computer Science
