Platform,course_title,Institution,num_subscribers,level,published_timestamp,subject
Udemy,QuickBooks Online : Inventory Management For Non-Finance,,8,All Levels,2017-04-20T22:15:19Z,Business Finance
Udemy,Law Matters,,327,Beginner,2015-03-27T17:16:21Z,Business Finance
Udemy,Learn to Trade for Profit: Finding Winning Stocks - Chinese,,264,All Levels,2015-10-08T17:04:03Z,Business Finance
Udemy,Financial Accounting Part 2 - Passing The Class,,15,Beginner,2017-05-01T22:58:40Z,Business Finance
Udemy,Simple Options Trading System,,104,Intermediate,2014-07-31T20:25:42Z,Business Finance
Udemy,Investments and Financial Markets,,71,Beginner,2014-07-22T19:08:41Z,Business Finance
Udemy,Legal Accounting,,26,All Levels,2014-09-21T04:58:16Z,Business Finance
Udemy,"Term Loan Appraisal for bankers, credit analysts",,11,Beginner,2017-04-03T16:53:57Z,Business Finance
Udemy,Small Biz Doers' Guide to Small Biz Accounting + Bookkeeping,,1294,Beginner,2013-08-28T03:28:52Z,Business Finance
Udemy,Trade Show Samurai,,32,All Levels,2013-08-29T15:44:46Z,Business Finance
Udemy,Forex Harmonic Trading- With Multiple Forex Chart Examples,,313,All Levels,2016-11-28T17:21:07Z,Business Finance
Udemy,The Cost of Capital: The Key To Attract Venture Capitalists,,635,All Levels,2016-03-22T20:47:21Z,Business Finance
Udemy,Accounting for School Students,,1311,All Levels,2015-05-22T23:32:56Z,Business Finance
Udemy,Learn To Trade The Forex Naked Price Action Acapulco Trade,,288,Intermediate,2016-01-25T18:11:00Z,Business Finance
Udemy,Certificate in MYOB AccountRight Premier 2017 Course,,97,All Levels,2016-03-10T23:45:35Z,Business Finance
Udemy,Master The Psychology of Forex & Binary Options Trading,,53,Intermediate,2016-07-04T18:47:36Z,Business Finance
Udemy,Learn to Pick the Right Stock Broker Account,,1102,Beginner,2014-12-24T21:50:11Z,Business Finance
Udemy,Profit During Crashing Markets: A Step-by-Step Guide,,57,All Levels,2016-05-16T21:38:56Z,Business Finance
Udemy,Introduction to Futures & Options,,694,All Levels,2014-03-11T17:06:53Z,Business Finance
Udemy,Learn To Invest In 7 Steps,,137,Beginner,2015-03-29T21:12:54Z,Business Finance
Udemy,Sell like a Pro: Insider Secrets of Successful Selling!,,12,All Levels,2016-11-01T15:47:26Z,Business Finance
Udemy,3 Little Pigs: A Multiple Timeframe Forex Trading Strategy,,18,All Levels,2017-02-24T16:33:34Z,Business Finance
Udemy,6. Annuities Due and Deferred,,170,All Levels,2014-02-24T13:53:23Z,Business Finance
Udemy,CFAÂ® Level 1 2014 â€“ Quantitative Methods,,119,All Levels,2015-02-26T10:06:11Z,Business Finance
Udemy,IFRIC 13-Customer Loyalty Programmes (Revenue),,2058,All Levels,2014-07-05T19:43:15Z,Business Finance
Udemy,FOREX Currency Trading For Beginners,,35,Beginner,2014-06-17T22:18:21Z,Business Finance
Udemy,Basic Technical Analysis,,40,Beginner,2015-08-05T17:19:03Z,Business Finance
Udemy,Forex:Trade Management & Psychology,,13,Intermediate,2016-09-21T19:07:06Z,Business Finance
Udemy,"Working Capital assessment for bankers, credit analysts",,4,Beginner,2017-04-06T23:30:07Z,Business Finance
Udemy,"CFA Level I Workshop 6: Alternatives, PM and Economics ",,71,All Levels,2013-08-12T14:20:49Z,Business Finance
Udemy,CFA Level I Workshop 3: Financial Reporting & Analysis II,,71,All Levels,2013-08-12T13:31:41Z,Business Finance
Udemy,How to trade in the Forex market,,6,Intermediate,2017-03-29T16:19:49Z,Business Finance
Udemy,Bookkeeping Practicals with Software,,1,Intermediate,2017-02-07T00:16:24Z,Business Finance
Udemy,8 Steps To Achieve Financial Freedom And Escape Debt,,5,Beginner,2015-11-13T17:43:47Z,Business Finance
Udemy,Trading Basics in 30 minutes,,1,Beginner,2017-02-26T21:59:25Z,Business Finance
Udemy,Technical Charting,,4,Intermediate,2015-11-02T20:23:54Z,Business Finance
Udemy,Profits Turbo,,10,Intermediate,2013-06-03T15:35:46Z,Business Finance
Udemy,Nest Egg Investing,,6,Beginner,2014-06-27T15:15:12Z,Business Finance
Udemy,Economics for beginners - Various Concepts,,2,Beginner,2017-01-02T14:58:36Z,Business Finance
Udemy,Investing in Stocks & Shares,,2,Beginner,2016-05-23T06:21:40Z,Business Finance
Udemy,Learn Financial Modeling from Scratch - Part 2,,2,All Levels,2016-04-07T15:15:10Z,Business Finance
Udemy,Learn Financial Modeling from Scratch - Part 3,,2,All Levels,2016-04-07T14:59:39Z,Business Finance
Udemy,A Practical Guide to Wealth Creation,,6,All Levels,2016-11-18T14:51:43Z,Business Finance
Udemy,"'Geometry Of Chance strategy of defeating the roulette.""",,2,Intermediate,2016-06-28T17:51:41Z,Business Finance
Udemy,Trading AlgorÃ­tmico en Forex: Crea tu primer Robot de Forex!,,206,All Levels,2016-03-12T04:31:12Z,Business Finance
Udemy,MQL4 Bootcamp Tutorial- Trading Robot Coding in Metatrader4,,313,Beginner,2015-07-05T17:54:35Z,Business Finance
Udemy,IntroducciÃ³n a la contabilidad,,193,Beginner,2014-12-17T12:50:58Z,Business Finance
Udemy,Einnahmen aus Udemy-Kursen als Dozent korrekt versteuern,,66,Beginner,2015-04-09T18:14:44Z,Business Finance
Udemy,Contabilidad Gubernamental en MÃ©xico,,270,All Levels,2015-08-14T19:29:24Z,Business Finance
Udemy,æ ªå¼æŠ•è³‡ã«å¿…è¦ãªã‚¹ã‚­ãƒ«ã®å­¦ç¿’æ‰‹é †ã‚’å­¦ã¶,,139,Beginner,2016-06-09T15:18:03Z,Business Finance
Udemy,FormaÃ§Ã£o de preÃ§os em serviÃ§os,,77,Intermediate,2017-04-26T05:08:15Z,Business Finance
Udemy,"Geld verdienen mit dem Ticken der Uhr, wie Warren Buffett!",,225,All Levels,2016-03-30T01:44:45Z,Business Finance
Udemy,Ð¢Ð¾Ñ€Ð³Ð¾Ð²Ð»Ñ Ð´ÐµÐ»ÑŒÑ‚Ð°-Ð½ÐµÐ¹Ñ‚Ñ€Ð°Ð»ÑŒÐ½Ñ‹Ð¼Ð¸ ÑÑ‚Ñ€ÐµÐ½Ð³Ð»Ð°Ð¼Ð¸,,23,All Levels,2016-03-10T22:29:13Z,Business Finance
Udemy,GuÃ­a prÃ¡ctica para comprar acciones en la Bolsa de USA,,4876,Intermediate,2014-09-11T02:28:27Z,Business Finance
Udemy,Contabilidad Financiera: Conoce el Lenguaje de los Negocios.,,244,Beginner,2015-06-16T16:31:01Z,Business Finance
Udemy,Curso de Day Trader para Iniciantes,,1278,Beginner,2016-11-03T13:44:03Z,Business Finance
Udemy,Curso de IniciaciÃ³n al Trading,,31,All Levels,2015-11-26T05:26:14Z,Business Finance
Udemy,Complete GST Course For Small and Medium Enterprises,,8,Beginner,2017-06-14T16:32:26Z,Business Finance
Udemy,3 documentos clave para administrar tu empresa con Ã©xito,,40,Intermediate,2013-05-16T10:03:47Z,Business Finance
Udemy,Forex/Opciones Binarias para Principiantes,,9,Beginner,2016-04-01T21:22:52Z,Business Finance
Udemy,15 Mandamientos para ganar dinero en Bolsa,,45,All Levels,2014-10-14T17:33:27Z,Business Finance
Udemy,Le bitcoin et la blockchain,,13,All Levels,2017-03-13T23:49:47Z,Business Finance
Udemy,ContabilitÃ  Generale,,4,All Levels,2017-05-29T23:47:21Z,Business Finance
Udemy,Ð¢Ð¾Ñ€Ð³Ð¾Ð²Ð»Ñ Ð¾Ð¿Ñ†Ð¸Ð¾Ð½Ð°Ð¼Ð¸: ÐšÐ°Ðº Ð·Ð°Ñ€Ð°Ð±Ð¾Ñ‚Ð°Ñ‚ÑŒ Ð½Ð° Ð²Ð¾Ð»Ð°Ñ‚Ð¸Ð»ÑŒÐ½Ð¾ÑÑ‚Ð¸,,20,All Levels,2016-02-25T19:57:33Z,Business Finance
Udemy,Estrategias de InversiÃ³n aplicadas al mundo del trading,,9,All Levels,2016-05-26T21:11:53Z,Business Finance
Udemy,ãƒã‚¤ãƒŠãƒªãƒ¼ã‚ªãƒ—ã‚·ãƒ§ãƒ³å–å¼•,,29,All Levels,2016-11-28T17:50:49Z,Business Finance
Udemy,Caza los Enormes Movimientos del Mercado,,6,All Levels,2015-11-12T04:52:21Z,Business Finance
Udemy,Le basi del trading online,,7,Beginner,2017-05-31T17:02:09Z,Business Finance
Udemy,è‡ªåˆ†ã«åˆã£ãŸæŠ•è³‡ä¿¡è¨—ã‚’è¦‹ã¤ã‘ã‚ˆã†ï¼,,859,Beginner,2017-03-31T17:41:24Z,Business Finance
Udemy,Monatlich Geld anlegen fÃ¼r spÃ¤ter!,,5983,Beginner,2015-10-06T20:05:20Z,Business Finance
Udemy,Invierte en la Bolsa Mexicana y de USA,,1673,Beginner,2015-08-10T18:43:10Z,Business Finance
Udemy,GestÃ£o Financeira Para Pequenas e MÃ©dias Empresas,,1284,All Levels,2016-01-29T01:16:05Z,Business Finance
Udemy,Curso Completo de Bitcoin - Ganhe 0.00005 Bitcoin,,394,All Levels,2017-02-06T13:59:35Z,Business Finance
Udemy,Tudo sobre Investimentos em Renda Fixa,,689,All Levels,2016-08-22T14:42:20Z,Business Finance
Udemy,Aprende a invertir sin capital,,649,Beginner,2017-05-01T21:29:37Z,Business Finance
Udemy,Apprendre Ã  trader sur le marchÃ© du Forex - guide complet,,187,Beginner,2017-03-07T00:23:20Z,Business Finance
Udemy,IntroducciÃ³n a las Finanzas,,1798,Beginner,2015-01-27T20:20:34Z,Business Finance
Udemy,Finanzielle UnabhÃ¤ngigkeit-1: Erste Schritte zur Million,,465,Beginner,2016-09-12T21:20:45Z,Business Finance
Udemy,Forex para Principiantes-Ejemplos en VIVO de Trading Real,,813,Beginner,2015-10-05T16:19:45Z,Business Finance
Udemy,Finanzielle UnabhÃ¤ngigkeit-3 MillionÃ¤r werden mit Immobilien,,326,Advanced,2016-09-12T21:20:48Z,Business Finance
Udemy,Introduction to Health Financing,,26,Beginner,2016-05-17T19:10:41Z,Business Finance
Udemy,Accounting Cycle: Learn the concepts in 60 minutes,,26,All Levels,2016-01-26T22:07:31Z,Business Finance
Udemy,Optimize! Make Best Decisions with Microsoft Excel,,28,Advanced,2015-04-01T18:09:44Z,Business Finance
Udemy,Understanding The Stock Market: For Beginners,,122,Beginner,2014-11-18T18:43:41Z,Business Finance
Udemy,CFAÂ® Level 1 2014 â€“ FI,,149,All Levels,2015-03-08T22:31:50Z,Business Finance
Udemy,9. Sinking Funds,,205,All Levels,2014-02-11T18:08:38Z,Business Finance
Udemy,Managerial Accounting - The Ultimate Beginner Course!,,11,Beginner,2017-04-13T00:20:15Z,Business Finance
Udemy,Forex Trading for Beginners Vol 1:A Forex Course Made Simple,,3,Beginner,2017-07-04T22:23:09Z,Business Finance
Udemy,Accounting - Basic Costing ,,108,Beginner,2015-08-04T18:45:56Z,Business Finance
Udemy,"Double Your Salary With Free, Local, Job Training Courses",,8,All Levels,2017-04-17T16:33:31Z,Business Finance
Udemy,Financial Modeling - Facebook Case Study,,9,All Levels,2013-10-02T05:31:08Z,Business Finance
Udemy,Understanding Financial Derivatives,,16,Intermediate,2017-03-24T22:25:11Z,Business Finance
Udemy,Forex Basics: Learn how to read and analyze Forex charts,,11,Beginner,2016-09-22T16:40:03Z,Business Finance
Udemy,Forex - Help I cant Trade,,12,All Levels,2016-10-18T18:51:48Z,Business Finance
Udemy,Start-up financial modeling for non-finance professionals,,11,All Levels,2016-06-20T21:49:39Z,Business Finance
Udemy,The Fast Route to a Faster Financial Close,,2,Intermediate,2017-06-23T22:05:17Z,Business Finance
Udemy,Easy Finance For Startups,,9,Beginner,2016-10-16T21:15:15Z,Business Finance
Udemy,"Excel 4 Accounting & Bookkeeping - Master Date,Time & Text",,15,All Levels,2016-06-27T21:19:23Z,Business Finance
Udemy,"Depreciation, Amortization and Depletion",,7,Intermediate,2017-03-06T23:59:02Z,Business Finance
Udemy,Breakeven Analysis and Pricing,,27,All Levels,2014-09-22T04:32:37Z,Business Finance
Udemy,Tally ERP Complete Training in Urdu / Hindi,,5,All Levels,2017-02-02T17:03:27Z,Business Finance
Udemy,Accounting Simplified,,3,All Levels,2017-05-03T16:14:01Z,Business Finance
Udemy,Series 7: Intermediate Options,,5,Intermediate,2017-04-17T22:33:36Z,Business Finance
Udemy,Accounting and Business Basics,,5,All Levels,2017-01-19T16:37:27Z,Business Finance
Udemy,Corso introduttivo al trading profittevole,,132,Beginner,2015-11-23T18:56:57Z,Business Finance
Udemy,Aprende a Ganar Dinero en la Bolsa,,112,All Levels,2013-12-11T15:06:56Z,Business Finance
Udemy,InversiÃ³n: Fundamentos del Trading para Principiantes,,285,Beginner,2015-10-26T17:50:47Z,Business Finance
Udemy,Gana en la Bolsa con AnÃ¡lisis TÃ©cnico,,91,Beginner,2014-01-29T09:35:29Z,Business Finance
Udemy,PrecificaÃ§Ã£o - Calculando valor de venda baseado nos custos,,32,All Levels,2017-04-19T06:53:19Z,Business Finance
Udemy,CÃ³mo ganar dinero invirtiendo en bolsa,,2740,Beginner,2016-04-02T01:46:55Z,Business Finance
Udemy,Investiere in Tax Liens-Hohe Zinsen gesetzl. festgeschrieben,,59,All Levels,2015-02-25T15:13:13Z,Business Finance
Udemy,Investimento em AÃ§Ãµes,,16,Beginner,2017-03-27T16:45:29Z,Business Finance
Udemy,Excelã‚’ä½¿ã£ã¦ãƒ“ã‚¸ãƒã‚¹ã‚·ãƒŸãƒ¥ãƒ¬ãƒ¼ã‚·ãƒ§ãƒ³ï¼šåŸºç¤Žç·¨,,22,Beginner,2017-05-18T22:31:23Z,Business Finance
Udemy,Estrategias de trading en bolsa,,15,All Levels,2016-12-10T01:25:07Z,Business Finance
Udemy,Grundlagen der finanziellen UnabhÃ¤ngigkeit,,1059,All Levels,2016-04-21T19:07:16Z,Business Finance
Udemy,"Wie Du, Dir auch mit kleinen BetrÃ¤gen ein VermÃ¶gen aufbaust",,187,All Levels,2016-12-14T20:18:45Z,Business Finance
Udemy,Corporate Ethics,,0,Beginner,2017-07-03T21:39:13Z,Business Finance
Udemy,CFA Level 2- Quantitative Methods,,0,All Levels,2017-07-02T14:29:35Z,Business Finance
Udemy,Core Financial Statement Concepts,,0,Intermediate,2017-06-28T21:58:15Z,Business Finance
Udemy,Understand Core Finance Principles in 60 Minutes,,0,Beginner,2017-06-29T22:04:17Z,Business Finance
Udemy,Learn Wave accounting to maintain books properly,,1089,All Levels,2016-01-13T22:06:39Z,Business Finance
Udemy,Making Tax Digital - UK HMRC Legislation Explained,,743,All Levels,2017-06-06T14:13:15Z,Business Finance
Udemy,Surviving Introduction to Finance,,1362,Beginner,2014-02-06T03:58:39Z,Business Finance
Udemy,Cost of Capital and Weighted Average Cost of Capital,,405,All Levels,2016-04-11T20:44:34Z,Business Finance
Udemy,Studying the CFA Program exams (Mandarin language version),,1168,All Levels,2014-04-09T08:38:41Z,Business Finance
Udemy,Condor Broken Wing Butterfly Options Trading Course System,,16,All Levels,2017-07-06T19:47:16Z,Business Finance
Udemy,â‰ªè™Žã®å·»â‰«è¨¼åˆ¸å–å¼•ã®ã€Œç¨Žé‡‘ã®ãŠæ‚©ã¿ã€è§£æ¶ˆ,,3840,Intermediate,2017-02-21T17:14:03Z,Business Finance
Udemy,ã€ï¼‘æ—¥ã§ãƒžã‚¹ã‚¿ãƒ¼ï¼ã€‘ä»Šæ—¥ã‹ã‚‰ã¯ã˜ã‚ã‚‹è³‡ç”£å½¢æˆ,,7183,Beginner,2017-01-19T23:51:32Z,Business Finance
Udemy,TRADING FOR A LIVING: Trading Full-Time Transition Guide,,483,Intermediate,2015-11-06T16:18:48Z,Business Finance
Udemy,Learn How To use Channels to find amazing Forex Entries,,172,All Levels,2017-05-24T18:05:36Z,Business Finance
Udemy,"Financial Analysis, from Scratch to Professional!",,256,Beginner,2016-03-06T23:27:44Z,Business Finance
Udemy,Cost Accounting Labour Costing (Professional Course Level),,1542,All Levels,2015-04-20T18:33:40Z,Business Finance
Udemy,Learn How To Successfully Trade Forex: In 5 Simple Steps,,64,All Levels,2017-05-03T22:09:03Z,Business Finance
Udemy,The Intelligent Investor,,384,All Levels,2015-08-27T00:02:29Z,Business Finance
Udemy,Succeed in Futures Even if You Don't Know Where to Start,,3014,All Levels,2017-01-03T05:58:06Z,Business Finance
Udemy,Binary Options Beginners Guide : Nadex,,454,Beginner,2015-01-09T19:32:53Z,Business Finance
Udemy,Trading: From Wall Street to Your Street,,312,Intermediate,2014-12-18T21:53:53Z,Business Finance
Udemy,Build your own Naked Trading Forex Robot,,315,All Levels,2015-08-11T21:24:32Z,Business Finance
Udemy,Tax Preparation: Learn Fast! Prepare Taxes with Confidence!,,609,All Levels,2016-01-12T17:07:39Z,Business Finance
Udemy,Tax Strategies of the Wealthy,,207,Beginner,2016-04-29T23:25:42Z,Business Finance
Udemy,The Ultimate Fibonacci Trading Plan for Forex and Stocks,,399,All Levels,2016-08-19T19:12:04Z,Business Finance
Udemy,Finance and Accounting for Startups,,1175,All Levels,2013-01-15T02:01:23Z,Business Finance
Udemy,Forex - Calculate Lot Size Like Pro,,543,All Levels,2016-06-21T03:14:09Z,Business Finance
Udemy,The Complete Forex Trader,,1634,All Levels,2012-10-01T09:46:23Z,Business Finance
Udemy,Tape Reading: Learn how to read the tape for day trading,,1013,All Levels,2014-03-27T07:14:55Z,Business Finance
Udemy,4 Easy Daily Forex Trades: A Recipe for Trading Success,,319,All Levels,2016-11-17T00:37:02Z,Business Finance
Udemy,Trading Robot Forex Programs in Your Sleep in Live Examples!,,1125,Advanced,2016-01-28T23:03:11Z,Business Finance
Udemy,Free Options 101 - Basic of Call and Put Options in 1 Hours,,2481,All Levels,2016-08-22T18:10:12Z,Business Finance
Udemy,An Intro into Trading the Financial Markets,,1006,Beginner,2016-09-03T03:46:23Z,Business Finance
Udemy,Developing A Trading Strategy: Your Guide to Trading Success,,1044,All Levels,2015-12-17T21:50:23Z,Business Finance
Udemy,How to Trade Commodity and Financial Futures for a Living!,,1240,All Levels,2016-01-15T23:53:00Z,Business Finance
Udemy,How to Trade Forex like a Hedge Fund: Long FX Strategies,,504,All Levels,2017-03-23T16:23:33Z,Business Finance
Udemy,Complete Short Financial Ratio Course for Financial Analysis,,15,All Levels,2017-06-28T17:44:56Z,Business Finance
Udemy,How to Build Profitable FOREX Automated Trading Strategies!,,358,All Levels,2015-11-11T01:16:13Z,Business Finance
Udemy,Stock Trading Strategies: Profitable Trading in 7 Days.,,80,All Levels,2015-06-16T00:09:26Z,Business Finance
Udemy,Management Accounting A Complete Study,,133,All Levels,2016-12-29T15:07:43Z,Business Finance
Udemy,Become a Career Day Trader: Asian-Pacific Futures Markets,,207,All Levels,2014-01-27T21:44:25Z,Business Finance
Udemy,Equity Products,,426,All Levels,2014-03-11T15:48:52Z,Business Finance
Udemy,Financial Accounting Part I - Passing the Class,,45,Beginner,2016-06-29T14:53:51Z,Business Finance
Udemy,Accounting 102: Guide to Business Accounting,,1280,Intermediate,2014-05-09T09:48:53Z,Business Finance
Udemy,Monetizing Your Website: How to Add Cost-Per-Action (CPA) ,,142,All Levels,2014-06-30T17:05:14Z,Business Finance
Udemy,Advanced Finance and Accounting for Startups,,188,Intermediate,2014-02-27T17:58:02Z,Business Finance
Udemy,Basics of Tax in India  (College Level),,718,All Levels,2015-01-31T13:53:48Z,Business Finance
Udemy,Trade for a Living,,293,All Levels,2014-03-22T22:56:09Z,Business Finance
Udemy,Learn Stock Options: Options Made Simple 101,,93,Beginner,2016-08-17T04:53:31Z,Business Finance
Udemy,Banking Credit Analysis Process (for Bankers),,894,Beginner,2014-07-12T11:00:16Z,Business Finance
Udemy,Professional Forex strategy,,353,Advanced,2016-02-03T04:10:53Z,Business Finance
Udemy,A Beginners Guide to Technical Analysis of Stock Charts,,829,Beginner,2013-09-15T15:06:02Z,Business Finance
Udemy,Get out of Debt - The Power of Using Compounding Interest,,1195,All Levels,2015-01-12T00:55:49Z,Business Finance
Udemy,Day Trading - Learn to Day Trade / Swing Trade In One Hour.,,335,All Levels,2015-11-27T17:38:51Z,Business Finance
Udemy,Basel Norms (Basel 1/ Basel 2/ Basel 3) Simplified,,500,Beginner,2015-04-26T19:26:45Z,Business Finance
Udemy,Learn to Trade Forex Naked Price Action Wammie Trade,,159,All Levels,2016-02-17T19:07:59Z,Business Finance
Udemy,Fixed Income Securities,,739,All Levels,2014-03-11T16:29:50Z,Business Finance
Udemy,Financial Accounting Made Easy for All,,87,All Levels,2015-09-01T18:36:10Z,Business Finance
Udemy,Ultimate Guide To Trading Engulfing Candlestick Strategy,,185,All Levels,2016-10-25T02:14:44Z,Business Finance
Udemy,Learn Business Finance: Win more work as a Business Coach ,,741,Beginner,2016-01-03T22:45:32Z,Business Finance
Udemy,Accounting for Depreciation (Collage Level),,576,All Levels,2014-07-09T09:41:36Z,Business Finance
Udemy,Revealed: Profitable Principles of Successful Traders ,,1046,All Levels,2013-05-19T01:51:44Z,Business Finance
Udemy,Easy Market Profits: 3 Step Stock Investing Strategy,,486,Beginner,2015-09-23T18:07:30Z,Business Finance
Udemy,Hedge Fund Trading Systems For Stocks - Part One,,52,All Levels,2016-10-29T21:56:38Z,Business Finance
Udemy,Bonds For Beginners - A Guide To The Bond Markets,,106,Beginner,2015-04-20T21:17:15Z,Business Finance
Udemy,Professional Risk Manager (PRM) Certification: Level 4,,38,All Levels,2013-07-23T20:28:06Z,Business Finance
Udemy,Crowdfunding for Filmmakers,,32,All Levels,2015-12-01T18:38:53Z,Business Finance
Udemy,How to Make IT Work Successfully in Capital Markets,,171,Beginner,2014-03-11T16:26:48Z,Business Finance
Udemy,Introduction to Day Trading,,79,Beginner,2014-09-05T04:38:45Z,Business Finance
Udemy,Life Coach Business Basics: Finance and Operations,,397,All Levels,2015-08-27T23:35:24Z,Business Finance
Udemy,Learn How to Profit In Forex With Market Rhythms,,85,All Levels,2014-08-02T17:13:03Z,Business Finance
Udemy,Optimizing investment to maximise your return,,1696,All Levels,2016-03-25T15:32:02Z,Business Finance
Udemy,Investimento em AÃ§Ãµes para Leigos,,201,Beginner,2016-11-11T15:53:07Z,Business Finance
Udemy,IntroducciÃ³n a la Contabilidad,,1235,Beginner,2015-01-23T20:22:18Z,Business Finance
Udemy,Forex Trading: Strategia Correlazione EUR/GBP vs GBP/USD,,137,Intermediate,2016-11-10T15:10:05Z,Business Finance
Udemy,Finanzielle UnabhÃ¤ngigkeit-2 MillionÃ¤r werden mit Investment,,384,Intermediate,2016-09-12T21:20:46Z,Business Finance
Udemy,ã‚«ãƒ¼ãƒ‰ã‚²ãƒ¼ãƒ ã§ã‚«ãƒ³ã‚¿ãƒ³ã«ç†è§£ã™ã‚‹ï¼çµŒæ¸ˆã¨ãŠé‡‘ã®ã‚­ãƒ›ãƒ³,,103,Beginner,2017-06-27T05:51:44Z,Business Finance
Udemy,Contabilidad rÃ¡pida y eficaz,,379,All Levels,2016-08-18T01:05:49Z,Business Finance
Udemy,IntroducciÃ³n al trading de opciones,,1573,Beginner,2015-02-17T02:52:02Z,Business Finance
Udemy,Aprenda a Investir seu Dinheiro,,150,All Levels,2017-01-20T14:57:34Z,Business Finance
Udemy,Trader sur le Forex avec Ichimoku,,48,Beginner,2017-05-05T16:58:52Z,Business Finance
Udemy,Ø§Ù„Ø¹Ù„ÙˆÙ… ÙˆØ§Ù„Ù…Ø¨Ø§Ø¯Ø¦ Ø§Ù„Ø£Ø³Ø§Ø³ÙŠØ© Ù„Ù„Ù…Ù‡Ù†Ø© Ø§Ù„Ø¥ÙƒØªÙˆØ§Ø±ÙŠØ©,,781,Beginner,2016-10-28T13:39:57Z,Business Finance
Udemy,ãƒˆãƒ¬ãƒ¼ãƒ‡ã‚£ãƒ³ã‚°ãƒ“ãƒ¥ãƒ¼å¾¹åº•æ”»ç•¥2017å¹´ç‰ˆ,,952,All Levels,2014-12-10T00:53:21Z,Business Finance
Udemy,Kostenrechnung lernen leicht gemacht,,612,Beginner,2016-06-06T17:43:52Z,Business Finance
Udemy,MetaTrader4 Platform Training,,1819,Beginner,2016-09-21T19:16:59Z,Business Finance
Udemy,Professional Bookkeeping & Accounting 1: Sales & Purchases,,551,All Levels,2015-09-27T16:52:26Z,Business Finance
Udemy,Step by step guide to understand how business perform,,788,Intermediate,2014-12-14T03:18:45Z,Business Finance
Udemy,How to Grow your Small Business and not run out of Cash,,408,Beginner,2016-04-05T18:55:57Z,Business Finance
Udemy,Finance for Non Finance Executives,,944,Beginner,2014-06-25T15:09:12Z,Business Finance
Udemy,"An Introduction: MT4 Email, Sound, Notification Forex Alerts",,323,Intermediate,2014-11-01T04:10:48Z,Business Finance
Udemy,Innovators and innovation: Travel through time!,,101,Beginner,2017-05-25T17:41:10Z,Business Finance
Udemy,Learn How to Trade The Stock Market,,984,All Levels,2016-03-02T18:19:36Z,Business Finance
Udemy,How To Earn Some Bitcoin Every Time You Use A Search Engine,,89,All Levels,2016-07-09T20:50:29Z,Business Finance
Udemy,Super Fast Accounting - the fastest way to do your books,,129,Beginner,2016-03-18T17:32:03Z,Business Finance
Udemy,Financial Modeling and Valuation: Complete Beginner to Pro,,249,All Levels,2016-06-20T22:09:31Z,Business Finance
Udemy,Learn to trade Chart Patterns,,75,Intermediate,2016-08-17T17:04:54Z,Business Finance
EdX,Introduction to Computer Science and Programming,MITx,62709,,9/26/2012,Computer Science
EdX,Introduction to Computer Science,HarvardX,129400,,10/15/2012,Computer Science
EdX,Introduction to Computer Science and Programming,MITx,65380,,2/4/2013,Computer Science
EdX,Introduction to Computer Science and Programming,MITx,57147,,10/16/2013,Computer Science
EdX,Introduction to Computer Science,HarvardX,259577,,1/1/2014,Computer Science
EdX,Building Mobile Experiences,MITx,25886,,2/4/2014,Computer Science
EdX,Introduction to Computer Science and Programming,MITx,21063,,2/19/2014,Computer Science
EdX,Introduction to Computational Thinking and Data Science,MITx,13148,,3/5/2014,Computer Science
EdX,Introduction to Computer Science and Programming,MITx,22148,,6/11/2014,Computer Science
EdX,Introduction to Computer Science and Programming,MITx,21017,,8/27/2014,Computer Science
EdX,Introduction to Computational Thinking and Data Science,MITx,11690,,10/21/2014,Computer Science
EdX,Introduction to Computer Science,HarvardX,301082,,1/1/2015,Computer Science
EdX,Introduction to Computer Science and Programming Using Python,MITx,49529,,1/7/2015,Computer Science
EdX,Building Mobile Experiences,MITx,18454,,2/2/2015,Computer Science
EdX,Computation Structures: Digital Circuits,MITx,15530,,3/3/2015,Computer Science
EdX,Introduction to Computational Thinking and Data Science,MITx,14835,,3/4/2015,Computer Science
EdX,Introduction to Computer Science and Programming,MITx,53964,,6/10/2015,Computer Science
EdX,Introduction to Computer Science and Programming Using Python,MITx,54361,,8/26/2015,Computer Science
EdX,Computation Structures: Digital Circuits,MITx,16094,,9/1/2015,Computer Science
EdX,Introduction to Computational Thinking and Data Science,MITx,12426,,10/20/2015,Computer Science
EdX,Computation Structures: Computer Architecture,MITx,8495,,11/17/2015,Computer Science
EdX,Introduction to Computer Science (2016),HarvardX,168335,,1/1/2016,Computer Science
EdX,Introduction to Computer Science and Programming Using Python,MITx,63658,,1/13/2016,Computer Science
EdX,Mobile Application Experiences: From a Domain to an App Idea,MITx,16407,,2/1/2016,Computer Science
EdX,Mobile Application Experiences: Mobile App Design,MITx,4522,,2/29/2016,Computer Science
EdX,Introduction to Computational Thinking and Data Science,MITx,14003,,3/2/2016,Computer Science
EdX,Mobile Application Experiences: Building Mobile Apps,MITx,4276,,3/28/2016,Computer Science
EdX,Mobile Application Experiences: Understanding Use,MITx,664,,4/25/2016,Computer Science
